question;questionText;type
urn:LCQuAD:id:1378;What belongs to the families of Buccinidae and Buccinoidea?;Species
urn:LCQuAD:id:3932;List  bacterias whose orde is Bacillales and division is Firmicutes?;Species
urn:LCQuAD:id:3924;Name the mammals which are primate and belongs to family of ape ?;Species
urn:LCQuAD:id:123;What are some families of mammals in the animal kingdom?;Species
urn:LCQuAD:id:3505;Whose families are Buccinoidea and Buccinidae?;Species
urn:LCQuAD:id:3678;What are some common ingredients used in Swedish dishes?;Species
urn:LCQuAD:id:513;What are a few molluscas whose family is Buccinidae?;Species
urn:LCQuAD:id:3594;Where did the music genre of Harry and the Potters originate?;TopicalConcept
urn:LCQuAD:id:4257;What are some characters of series produced by Ricky Grevais?;Work
urn:LCQuAD:id:465;List the show related to the which was followed by Doctor Who Extra?;Work
urn:LCQuAD:id:2351;Name the series of Doctor Who: Evacuation Earth ?;Work
urn:LCQuAD:id:3418;What are some short story kind of Books?;Work
urn:LCQuAD:id:4701;Which games publishers are located in California?;Work
urn:LCQuAD:id:1739;Give me some softwares which run on mac os;Work
urn:LCQuAD:id:1210;List the shows whose network is run by BBC.;Work
urn:LCQuAD:id:553;Name the TV show whose opening theme is Gary Portnoy and the subsequent work is Frasier?;Work
urn:LCQuAD:id:2195;List things developed by Autoconf ?;Work
urn:LCQuAD:id:1541;Which shows had their painters born in England?;Work
urn:LCQuAD:id:4995;What movies have been produced by the production house owned by Larry J. Franco?;Work
urn:LCQuAD:id:3429;Give me all tv shows which are based in boston and massachusetts?;Work
urn:LCQuAD:id:734;List the movies directed by Stanley Kubrick?;Work
urn:LCQuAD:id:4112;Which movies have their music composed by someone that signed up with RCA Records?;Work
urn:LCQuAD:id:2924;List the movies produced by Michael Deeley ?;Work
urn:LCQuAD:id:1095;What are the television shows which are in NTSC and 5.1 surround sound?;Work
urn:LCQuAD:id:1212;What are some games availible on nintendo s virtual console?;Work
urn:LCQuAD:id:1025;What is the television show whose sculptor is C. E. Webber and composed by Murray Gold?;Work
urn:LCQuAD:id:1041;What is the game platform of Google Cloud Connect ?;Work
urn:LCQuAD:id:1192;List softwares written in C++ and runs on Mac OS ?;Work
urn:LCQuAD:id:415;Name the sitcoms whose network s owning company is Chris-Craft Industries?;Work
urn:LCQuAD:id:4259;What are the television shows whose company is Playtone?;Work
urn:LCQuAD:id:1260;List the books whose authors are in Alcal de Henares.;Work
urn:LCQuAD:id:378;What are the books written by the the person who made the Novelas ejemplares?;Work
urn:LCQuAD:id:4035;What was created by Larry David and Jerry Seinfeld?;Work
urn:LCQuAD:id:2305;List TV shows with producer as Erik Bork and company is DreamWorks Television ?;Work
urn:LCQuAD:id:2722;Name the TV show broadcasted by Fox and presented by Ryan Seacrest ?;Work
urn:LCQuAD:id:2997;What is the musical whose music is by Jose Luis Narom,  based upon?;Work
urn:LCQuAD:id:4478;Which TV show s composer is Judy  Hart  Angelo and executive producer as Glen and Les Charles?;Work
urn:LCQuAD:id:150;Name some shows whose company is owned by the CBS Corporation?;Work
urn:LCQuAD:id:1305;Which things have been made by artists who died in Midhurst?;Work
urn:LCQuAD:id:1598;What television show are distributed by Broadcast syndication?;Work
urn:LCQuAD:id:4900;Which TV show s producer is Stephen E. Ambrose and company is DreamWorks Television?;Work
urn:LCQuAD:id:3975;Laozi authored which book?;Work
urn:LCQuAD:id:1862;What are the movies whose musicians s home town is Volos?;Work
urn:LCQuAD:id:4528;What are some magazines whose publishers are themselves Rock and Roll Hall of Fame members?;Work
urn:LCQuAD:id:332;Which magazine s publisher is Jann Wenner and founded by Ralph J. Gleason?;Work
urn:LCQuAD:id:14;What tv series can be said to be related to the sarah jane adventure and dr who confidential?;Work
urn:LCQuAD:id:4385;Which sitcoms are made by a company headquartered in NYC?;Work
urn:LCQuAD:id:1905;Some movies whose screenplay is done by american born people?;Work
urn:LCQuAD:id:2835;Which work is both Neil Cross and Lars Pearson both known for ?;Work
urn:LCQuAD:id:1157;List the shows whose company s successor is Amblin Television.;Work
urn:LCQuAD:id:2388;What is the television show whose opening theme is Where Everybody Knows Your Name?;Work
urn:LCQuAD:id:1051;Which movies  composers have won a BAFTA for film music?;Work
urn:LCQuAD:id:4687;List the books by the authors buried in the Convent of the Barefoot Trinitarians?;Work
urn:LCQuAD:id:1837;What is the television show whose opening theme s album is Cheers?;Work
urn:LCQuAD:id:44;In which television shows have Steven Moffat served as an executive producer?;Work
urn:LCQuAD:id:413;What are the movies whose cinematographer is Gregg Toland?;Work
urn:LCQuAD:id:1881;What shows are on the networks which are from the United States?;Work
urn:LCQuAD:id:3123;Momoko Kchi has acted in which movie ?;Work
urn:LCQuAD:id:4377;What is the  name of the television show whose developer is J. Michael Straczynski and actor is Jason Carter (actor)?;Work
urn:LCQuAD:id:1522;Which software uses windows as it s operating system and is written in C++ ?;Work
urn:LCQuAD:id:4854;Which BBC s TV show is related with the Sarah Jane Adventures?;Work
urn:LCQuAD:id:1227;What are the shows whose creator has worked as a screenwriter?;Work
urn:LCQuAD:id:1225;What softwares were created by Apple Productivity Experience Group ?;Work
urn:LCQuAD:id:1893;What famous work is derived from the one whose lyrics are written by Inma Gonzales?;Work
urn:LCQuAD:id:2617;What is the television show whose previous work is The Spirit of Christmas (short film)?;Work
urn:LCQuAD:id:1476;Name the TV show whose cast member is Companion (Doctor Who) and is related to The Sarah Jane Adventures?;Work
urn:LCQuAD:id:3740;Which shows  opening themes was used to make If We Were a Movie?;Work
urn:LCQuAD:id:1580;Name few television shows s anchored by Ryan Seacrest?;Work
urn:LCQuAD:id:4574;Which televison shows have location as Massachusetts ?;Work
urn:LCQuAD:id:2218;What medals have been given to people who died of lung cancer?;Work
urn:LCQuAD:id:4287;What is the show which opens with Gary Portnoy and Where Everybody Knows Your Name?;Work
urn:LCQuAD:id:4194;Name the TV shows related to Babylon 5: The Lost Tales and is aired on Prime TIme Entertainment Networks ?;Work
urn:LCQuAD:id:4576;Give me some series whose network s owning company is Warner Bros. Television?;Work
urn:LCQuAD:id:660;List the notable work of David Isaacs (writer)?;Work
urn:LCQuAD:id:267;Which motion picture stories were edited by Ishir Honda?;Work
urn:LCQuAD:id:4442;Name the tv series produced by Stephen Ambrose and Erik Bork?;Work
urn:LCQuAD:id:3372;Which tv series have a score composed by judy hard angelo?;Work
urn:LCQuAD:id:3555;Name the movie whose director of photography is Gregg Toland and Bernard Herrmann was the music composer?;Work
urn:LCQuAD:id:550;Which television shows has sound format as 5.1 surround?;Work
urn:LCQuAD:id:4418;What products do US companies make?;Work
urn:LCQuAD:id:929;Which television show is the subsequent work of Frasier and the opening theme is Gary Portnoy?;Work
urn:LCQuAD:id:3905;Name all sitcoms whose theme music is made by Miley Cyrus?;Work
urn:LCQuAD:id:3804;What are the movies whose editor died in Westwood, Los Angeles?;Work
urn:LCQuAD:id:4776;What are the software which uses  platforms as ARM architecture?;Work
urn:LCQuAD:id:4554;What are the products of the company who published Robot Wars: Metal Mayhem ?;Work
urn:LCQuAD:id:2610;What are the television shows whose network is BBC HD?;Work
urn:LCQuAD:id:2023;What is the television show whose cast members are Jeff Conaway and Jason Carter?;Work
urn:LCQuAD:id:1754;List the movie whose music was given by Geoffrey Burgon and distributed by Cinema International Corporation?;Work
urn:LCQuAD:id:4036;Which license of the Microsoft Office Picture Manager is also the  product of the Apple Productivity Experience Group ;Work
urn:LCQuAD:id:212;What all is owned by a company one of whose division is Paramount Domestic Television?;Work
urn:LCQuAD:id:2822;What are the movies whose music composer is Akira Ifukube?;Work
urn:LCQuAD:id:3669;What all are written in the C programming language?;Work
urn:LCQuAD:id:392;What are some US citizens famous for?;Work
urn:LCQuAD:id:1948;List the subsequent work of the albums whose one of the subsequent work is Planet Waves?;Work
urn:LCQuAD:id:3892;What are the movies whose editor is Robert Wise?;Work
urn:LCQuAD:id:767;What are the television shows whose network s sister station is BBC Two?;Work
urn:LCQuAD:id:4119;What are the television shows whose network s successor is BBC Two?;Work
urn:LCQuAD:id:1960;What are the last two studio albums of Moondog Matinee ?;Work
urn:LCQuAD:id:4460;What television shows s distributor is Eurovision?;Work
urn:LCQuAD:id:4694;Which television show is based in Massachusetts and has opening theme as Where Everybody Knows Your Name ?;Work
urn:LCQuAD:id:2665;In what tv shows did Jason Carter act?;Work
urn:LCQuAD:id:1821;What are the software whose operating systems are Mac OS and Microsoft Windows?;Work
urn:LCQuAD:id:2668;Which television shows have been produced by Erik Bork?;Work
urn:LCQuAD:id:1826;To which books Thomas Egerton, an editor?;Work
urn:LCQuAD:id:3886;Which magazines were founded by ann Wenner ?;Work
urn:LCQuAD:id:1462;What are the movies whose music is composed by Vangelis?;Work
urn:LCQuAD:id:2578;Who is the publisher of The Rolling Stone Album Guide ?;Work
urn:LCQuAD:id:1440;Name the television show created by CE Webber and also has actor named Companion?;Work
urn:LCQuAD:id:3721;Producers of what have died in Mississippi?;Work
urn:LCQuAD:id:3614;List the software which uses Microsoft Windows as their operating system ?;Work
urn:LCQuAD:id:3481;What all has been created by Jerry Siegel?;Work
urn:LCQuAD:id:3126;Which shows are similar to the ones produced by Phil Collinson?;Work
urn:LCQuAD:id:2003;Movie s produced by Michael Deeley has Jordan Cronenweth as director of photography;Work
urn:LCQuAD:id:4089;Name some software as a service?;Work
urn:LCQuAD:id:4228;Name the TV shows whose developer is J. Michael Straczynski and executive producer is Douglas Netter?;Work
urn:LCQuAD:id:4907;What series is Mazes of Time from, and is produced by BBC multimedia?;Work
urn:LCQuAD:id:380;Name the TV show whose network is NBC and is the subsequent work of Fraiser ?;Work
urn:LCQuAD:id:4309;Name the movie whose director is Stanley Kubrick and editor is Anthony Harvey?;Work
urn:LCQuAD:id:4589;In which series has Sean Young portrayed someone?;Work
urn:LCQuAD:id:3093;Which are the television show which have been created by Donald Wilson?;Work
urn:LCQuAD:id:2514;What is the television show whose developer is J. Michael Straczynski?;Work
urn:LCQuAD:id:1007;What is the content license of Darcs ?;Work
urn:LCQuAD:id:1548;Which contnet license provider of Microsoft Office Picture Manager is also the game platform of Google Clud Connect ?;Work
urn:LCQuAD:id:1285;On which subjects does the author of the novel Thud! delve?;Work
urn:LCQuAD:id:2162;Which program was on NBC network with executive producer as Glen and Les Charles?;Work
urn:LCQuAD:id:1380;List down all notable works of Neil Cross ?;Work
urn:LCQuAD:id:3650;Name the television show whose subsequent work is Frasier and opening theme is Where Everybody Knows Your Name?;Work
urn:LCQuAD:id:3985;Which Tv series led to Frasier?;Work
urn:LCQuAD:id:1165;What is the television show whose opening theme is Te Deum (Charpentier)?;Work
urn:LCQuAD:id:244;To which series does the character of Londo Mollari belong?;Work
urn:LCQuAD:id:813;What are some movies written by British writers?;Work
urn:LCQuAD:id:3487;What tv shows were born out of a collaboration of playtone and dreamworks?;Work
urn:LCQuAD:id:2544;What are the famous Uni Toronto scientists known for?;Work
urn:LCQuAD:id:4293;Name few TV shows aired by Prime Time Entertainment Network?;Work
urn:LCQuAD:id:1466;Which series are Lennier and Londo Mollari both from?;Work
urn:LCQuAD:id:334;Which television show s network  is BBC HD and is related to Doctor Who Confidential?;Work
urn:LCQuAD:id:4991;List all the movies whose music has been made up with someone under RCA records?;Work
urn:LCQuAD:id:3861;List the magazines published by Playbow Enterprises ?;Work
urn:LCQuAD:id:1762;Which magazine has publisher as Jann Wenner?;Work
urn:LCQuAD:id:4451;What would be the most important creation which involved both Neil Cross and Russel Davies ?;Work
urn:LCQuAD:id:4356;Which TV show s setting is in Massachusetts and is the subsequent work of Fraiser ?;Work
urn:LCQuAD:id:520;What is the television show whose subsequent work is Crusade (TV series) and developed by  J. Michael Straczynski?;Work
urn:LCQuAD:id:1890;Which movies  music is composed by people associated with the band Yes?;Work
urn:LCQuAD:id:745;What are the movies directed by Joel Schumacher?;Work
urn:LCQuAD:id:4922;list the  software which works on both the OS  - Microsoft Windows and Mac OS ?;Work
urn:LCQuAD:id:65;Was Ganymede discovered by Galileo Galilei?;Boolean
urn:LCQuAD:id:3906;Does the Toyota Verossa have the front engine design platform?;Boolean
urn:LCQuAD:id:2570;Was Mark Twain a character of Mark Twain Tonight?;Boolean
urn:LCQuAD:id:3862;Is the song Killing is Out, School is in belong in the The Next Step?;Boolean
urn:LCQuAD:id:3340;Is camel  of the chordate phylum?;Boolean
urn:LCQuAD:id:227;Does the merlin express have a hub at the cibano international airport?;Boolean
urn:LCQuAD:id:296;Was Duanne Allman known to play the Les Paul?;Boolean
urn:LCQuAD:id:2123;Did Paul Weatherwax an editor of Behave Yourself?;Boolean
urn:LCQuAD:id:2094;does the journal of cancer have the creative commons license?;Boolean
urn:LCQuAD:id:199;Was Jack Ryan a nominee of US Senate?;Boolean
urn:LCQuAD:id:3150;Is my truly truly fair the band of mitch miller?;Boolean
urn:LCQuAD:id:964;Is nintendo in the video games industry?;Boolean
urn:LCQuAD:id:3664;Do the polet airlines fly to moscow?;Boolean
urn:LCQuAD:id:3143;Does Cohoes a junction on the NY State Route 470?;Boolean
urn:LCQuAD:id:1052;Is Microsoft office written in C++;Boolean
urn:LCQuAD:id:4666;Did Chant Mas originate in West Africa?;Boolean
urn:LCQuAD:id:733;Does Gibby Haynes play the saxophone?;Boolean
urn:LCQuAD:id:4582;Is The Orator in the National Archaeological Museum of Florence?;Boolean
urn:LCQuAD:id:653;Did Hank Williams Jr. make Early in the Morning and Late at Night?;Boolean
urn:LCQuAD:id:1483;Was Marie Curie a doctoral student of Henri Becquerel?;Boolean
urn:LCQuAD:id:2893;Was Duanne Allman famous for playing the Gibson SG?;Boolean
urn:LCQuAD:id:1261;Is Guatemala a unitary state?;Boolean
urn:LCQuAD:id:3686;Was Castillo discovered by Galileo?;Boolean
urn:LCQuAD:id:1424;Does A foreign policy of freedom belong to the genre Politics?;Boolean
urn:LCQuAD:id:2374;Does the north carolina highway 280 end in Arden?;Boolean
urn:LCQuAD:id:2225;Is Angola Avante the anthem of Angola?;Boolean
urn:LCQuAD:id:4504;Does the mississippi orignate in the clearwater county, minnesota?;Boolean
urn:LCQuAD:id:4802;Is Judy Garland a character of End of the Rainbow?;Boolean
urn:LCQuAD:id:2107;Does Silver Airways have a hub at the Washington Dulles International Airport?;Boolean
urn:LCQuAD:id:893;Does Walt Disney Studio have a subsidiary called PixarCascadia_;Boolean
urn:LCQuAD:id:3918;Is Julia Gillard the prime minister of Kate Lundy?;Boolean
urn:LCQuAD:id:683;Does the little colorado river flow in the Grand Canyon?;Boolean
urn:LCQuAD:id:4647;Is Mona Lisa in the Louvre museum?;Boolean
urn:LCQuAD:id:315;Was A foreign policy on freedom covered by John Trumbull?;Boolean
urn:LCQuAD:id:2121;Was Apollo 11 a mission of Niel Armstrong?;Boolean
urn:LCQuAD:id:811;Is the charat district a district in peru?;Boolean
urn:LCQuAD:id:2623;Is the College Sainte Marie in Mauritius?;Boolean
urn:LCQuAD:id:2594;CN Atletic-Barceloneta has a stadium in Barcelona?;Boolean
urn:LCQuAD:id:1235;Is the Frank R Lillie House has the Chicago architecture?;Boolean
urn:LCQuAD:id:1292;Is Wahoo! the previous work of Honeybuns?;Boolean
urn:LCQuAD:id:4679;Is Labor relations the main interest of Karl Marx?;Boolean
urn:LCQuAD:id:3957;Did Dean Wurzberger manage a club at the santa clara university?;Boolean
urn:LCQuAD:id:354;Did stan lee narrate the incredible hulk tv show?;Boolean
urn:LCQuAD:id:996;Is Peter Crouch currently in the Stoke City FC?;Boolean
urn:LCQuAD:id:2405;Is the Mount St Peter Church made in the international architectural style?;Boolean
urn:LCQuAD:id:3707;Was the cover of The adventures of Tom Sawyer designed by Mark Twain?;Boolean
urn:LCQuAD:id:291;Is Bacillus belong to the domain Bacteria?;Boolean
urn:LCQuAD:id:3665;Is Trevor Peacock the narrator of Fred Claus?;Boolean
urn:LCQuAD:id:3988;Was A Jitney Elopement edited by Charlie Chaplin?;Boolean
urn:LCQuAD:id:3220;Was Henry Knox a major general?;Boolean
urn:LCQuAD:id:3846;Do the White Plains Road lie in the Bronx county?;Boolean
urn:LCQuAD:id:1126;Was 12th Field Artillery Regiment garrisoned at colorado?;Boolean
urn:LCQuAD:id:1699;Is Esther Alder the mayor of Geneva?;Boolean
urn:LCQuAD:id:596;Is National Archaeological Museum (Florence) the museum of Chimera of Arezzo?;Boolean
urn:LCQuAD:id:3676;Is Eddie Bravo the trainer of Alan Jouban;Boolean
urn:LCQuAD:id:566;Was the FIS Alpine World Ski Championship of 1950 held in Colorado?;Boolean
urn:LCQuAD:id:3745;Does GeneWeb have the GPL license?;Boolean
urn:LCQuAD:id:4403;Is Darcs released with a GNU license?;Boolean
urn:LCQuAD:id:3955;Was the body of Elsie Paroubek discovered in Chicago?;Boolean
urn:LCQuAD:id:4841;Is Michelle D. Johnson the superintendent of United States Air Force Academy?;Boolean
urn:LCQuAD:id:4998;Is NY Rangers a prospective team for Robin Kovacs?;Boolean
urn:LCQuAD:id:4826;Is the Columbia University chaired by William Campbell?;Boolean
urn:LCQuAD:id:2662;Was Let it Be written by Ringo Starr?;Boolean
urn:LCQuAD:id:2721;Was George Cash in the western australian parliament?;Boolean
urn:LCQuAD:id:833;Is Joe Schilling the trainer of Nick Diaz?;Boolean
urn:LCQuAD:id:3567;Sampson Cudjoe plays for the Ghana national team?;Boolean
urn:LCQuAD:id:2763;Does Lionel Messi play in the Argentina National Football Team?;Boolean
urn:LCQuAD:id:2228;Is the Providence Chapel, Charlwood made in New English style of architecture?;Boolean
urn:LCQuAD:id:1032;Is Halyna Kukhar the former coach of Stanislav Morozov?;Boolean
urn:LCQuAD:id:668;Was the Army Air Corps honored for the battle of Iraq?;Boolean
urn:LCQuAD:id:3485;Does Saneh Lungkeaw play for the Thailand s national team?;Boolean
urn:LCQuAD:id:2330;Does mumbai manage the railway line going to the daund railway junction?;Boolean
urn:LCQuAD:id:450;Was Derg the anthem of Ethopia?;Boolean
urn:LCQuAD:id:1946;Is Dave Schulz a band member of Berlin?;Boolean
urn:LCQuAD:id:4193;Is Eddie Bravo the trainer of Shinya Aoki?;Boolean
urn:LCQuAD:id:3867;Was Blade Runner cinematographed by JordanCronenweth?;Boolean
urn:LCQuAD:id:2834;Did Joe Namath did his highschool in Beaver Falls High School?;Boolean
urn:LCQuAD:id:1822;Does the Utah State Route 162 end at Colorado?;Boolean
urn:LCQuAD:id:3357;Is GIMP written in C?;Boolean
urn:LCQuAD:id:535;Does NOAAS Davidson (S 331) have a homeport in Seattle?;Boolean
urn:LCQuAD:id:1181;Did Alexander Magleby study at the Dartmouth College?;Boolean
urn:LCQuAD:id:461;Was the  2d Command and Control Squadron barracked in Colorado?;Boolean
urn:LCQuAD:id:2865;Was Lionel Messi a member  of the 2009 FIFA World Cup squads?;Boolean
urn:LCQuAD:id:871;Was Writings and Drawings illustrated by Bob Dylan?;Boolean
urn:LCQuAD:id:3833;Was the Lotuspool Records distributed by Napster?;Boolean
urn:LCQuAD:id:3047;Do the west coast airlines fly to seattle?;Boolean
urn:LCQuAD:id:2718;Was John of Damascus canonized by Anglican Communion?;Boolean
urn:LCQuAD:id:2765;Was X the Unknown edited by James needs?;Boolean
urn:LCQuAD:id:2916;Is Ingo Steuer the formercoach of Stanislav Morozov?;Boolean
urn:LCQuAD:id:1720;Is Liang Chow the headcoach of Shawn Johnson?;Boolean
urn:LCQuAD:id:2057;Is James Wong Howe the cinematographer of Behave Yourself?;Boolean
urn:LCQuAD:id:2646;Does Heydar mean the same as a lion?;Boolean
urn:LCQuAD:id:32;Was Kevin Jonas a part of Jonas brothers?;Boolean
urn:LCQuAD:id:1808;Was David Gilmour a former member of Pink Floyd?;Boolean
urn:LCQuAD:id:1714;was Charlemagne canonized by antipope pachal 3?;Boolean
urn:LCQuAD:id:2404;Was einstein a doctoral student of Alfred Kleiner?;Boolean
urn:LCQuAD:id:4461;Did Stan Lee create Jean Grey?;Boolean
urn:LCQuAD:id:3660;Is WP 8.1 the OS on Lumia 830?;Boolean
urn:LCQuAD:id:2213;Is the song Only the Good Die Young from The Stranger?;Boolean
urn:LCQuAD:id:1264;Did taylor swift do the theme song of The Farmer Wants a Wife?;Boolean
urn:LCQuAD:id:1770;Did Trish Stratus train Christina Crawford?;Boolean
urn:LCQuAD:id:2787;Is wizard rock inspired from Harry potter?;Boolean
urn:LCQuAD:id:4376;Is Neungin High school a buddhist school?;Boolean
urn:LCQuAD:id:912;Was Zambezi originate in the north western province of zambia?;Boolean
urn:LCQuAD:id:2859;is ANYway in the Quack album?;Boolean
urn:LCQuAD:id:2154;Was Robert Burns from the Romanticist School of thought?;Boolean
urn:LCQuAD:id:4144;Does the platte river originate in Colorado?;Boolean
urn:LCQuAD:id:263;Is KOMC-FM the sister station of KOMC (AM)?;Boolean
urn:LCQuAD:id:3704;Was Beth Tweddle primarily coached by Amanda Reddin?;Boolean
urn:LCQuAD:id:1071;Was robert sarvis a nominee of the US Senate?;Boolean
urn:LCQuAD:id:1207;Is lion an animal?;Boolean
urn:LCQuAD:id:1003;Did Oliver Sacks study at the Columbia University?;Boolean
urn:LCQuAD:id:2197;Was His New Job edited by Charlie Chaplin?;Boolean
urn:LCQuAD:id:898;Does vance johnson play as a wide receiver?;Boolean
urn:LCQuAD:id:3785;Is Luigi Brugnaro the mayor of Venice?;Boolean
urn:LCQuAD:id:2989;Was elizabeth ann seton beatified by Pope John XXIII?;Boolean
urn:LCQuAD:id:4416;Were the bodies involved in the Westroads mall shootings discovered in Nebraska?;Boolean
urn:LCQuAD:id:2072;Is stephanie a female?;Boolean
urn:LCQuAD:id:4450;Did Bob Suci play for the New England Patriots?;Boolean
urn:LCQuAD:id:1216;Is the magnolia place of the greek revival architectural style?;Boolean
urn:LCQuAD:id:420;Does Caroline Augusta Foley Rhys Davids study Buddhism?;Boolean
urn:LCQuAD:id:3303;Is Denver the largest city of Colorado?;Boolean
urn:LCQuAD:id:2302;Does Abdelhameed Amarri currently play for Khartoum?;Boolean
urn:LCQuAD:id:2036;Is Giorgos Kaminis the mayor of Athens?;Boolean
urn:LCQuAD:id:2231;Is Tenzing Norgay  the first person to scale Mt. Everest?;Boolean
urn:LCQuAD:id:4384;Is Pulau Ubin the largest city of Singapore?;Boolean
urn:LCQuAD:id:654;Is Pixar Canada a subsidiary of Pixar?;Boolean
urn:LCQuAD:id:2354;Is Lyndon bridge a kind of Truss bridge?;Boolean
urn:LCQuAD:id:2186;Was Liliya Lobanova born in Ukraine?;Boolean
urn:LCQuAD:id:3963;Is the hyundai elantra related to hyundai lavita?;Boolean
urn:LCQuAD:id:4774;Is Serbian Titieca a doctoral student of Werner Heisenberghttp://dbpedia.org/resource/Werner_Heisenberg;Boolean
urn:LCQuAD:id:2321;Does the white river flow into the connecticut river{u _id : u 97e02dcf44aa43c1b7cc7a7c155b118f ,;Boolean
urn:LCQuAD:id:1366;Was andy worhol the director of the san diego surf?;Boolean
urn:LCQuAD:id:3633;Was the skeleton dance animated by Walt Disney?;Boolean
urn:LCQuAD:id:1356;Is coffee a main ingredient of Hopje?;Boolean
urn:LCQuAD:id:4201;Does KOMC play Gospel Music?;Boolean
urn:LCQuAD:id:4047;Was Krzystof Wielicki the first person that ascended the mt everest?;Boolean
urn:LCQuAD:id:1572;Does the river shannon originate from Dowra?;Boolean
urn:LCQuAD:id:381;Does chicago own the washington station on the CTA Blue Line?;Boolean
urn:LCQuAD:id:3503;Is GIMP written in GTK+?;Boolean
urn:LCQuAD:id:700;Is Julia Gillard a part of monarch of elizabeth 2?;Boolean
urn:LCQuAD:id:2895;Is Maldives a member ofof South Asia Subregional Economic Cooperation?;Boolean
urn:LCQuAD:id:2177;Is Rain Over me in the planet pit album?;Boolean
urn:LCQuAD:id:2242;Was Ne Daj Se, Nina first aired in Croatia?;Boolean
urn:LCQuAD:id:2751;Is Ian Thorpe the bronze medalist of Swimming at the 2004 Summer Olympics  Men s 100 metre freestyle?;Boolean
urn:LCQuAD:id:1224;Was George Washington on the rank of general?;Boolean
urn:LCQuAD:id:1952;Was the Incredibles released before Finding Nemo?;Boolean
urn:LCQuAD:id:3406;Were the 1995 south pacific games hosted in tahiti?;Boolean
urn:LCQuAD:id:3790;Is joel quenneville the main coach of Chicago Blackhawks?;Boolean
urn:LCQuAD:id:4457;Does the AMC Gremlin use an Audi engine?;Boolean
urn:LCQuAD:id:1138;Does Lousana lie at the end of Alberta Highway 42?;Boolean
urn:LCQuAD:id:532;Does the Westchester Avenue fall under the Bronx?;Boolean
urn:LCQuAD:id:1457;Was Noko a band member of Luxuria?;Boolean
urn:LCQuAD:id:264;Do the asiana airlines fly  to Jeju airport?;Boolean
urn:LCQuAD:id:1649;Is Plymouth High School for Girls in Devon county?;Boolean
urn:LCQuAD:id:2944;Is the Kia Sportage similar to the Hyundai Lavita?;Boolean
urn:LCQuAD:id:3482;Is David Cameron the prime minister of Nick Clegg?;Boolean
urn:LCQuAD:id:1880;Did Jim Kiick do his highschool in New Jersey?;Boolean
urn:LCQuAD:id:2341;Is Lieutenant general (United States) the superintendent of United States Air Force Academy?;Boolean
urn:LCQuAD:id:4155;Is the national endowment of arts under the jurisdiction of federal government of US?;Boolean
urn:LCQuAD:id:3910;Was Neil Armstrong on the Gemini 8 mission?;Boolean
urn:LCQuAD:id:836;Is James Hetfield a band member of Metallica?;Boolean
urn:LCQuAD:id:601;Does the Vadodara Railway station lie at the end of the Mathura Vadodara route?;Boolean
