question;questionText;type
urn:LCQuAD:id:4635;What is the occupation of the Irving Chernev and Karen Grigorian?;Activity
urn:LCQuAD:id:2527;What sport amongst the one Lagos Preparatory School practices, did Willian Garne play for?;Activity
urn:LCQuAD:id:151;Which sports are played at institues in Taguig?;Activity
urn:LCQuAD:id:4863;List the common sports between Fr. Agnel Multipurpose School  and Jamiatu Muslim Mindanao;Activity
urn:LCQuAD:id:4058;What is the game whose genre is Mind sport?;Activity
urn:LCQuAD:id:1351;What is the field of the Jon Speelman and occupation of the Karen Grigorian?;Activity
urn:LCQuAD:id:2932;What are the sports played by the universities who also plays taekwondo ?;Activity
urn:LCQuAD:id:1867;What made Jon Speelman and Eric Schiller famous?;Activity
urn:LCQuAD:id:2067;Name the sports played by Fr. Agnel Multipurpose School and Junior College?;Activity
urn:LCQuAD:id:2078;What games are played at universities in Lanao Del Sur?;Activity
urn:LCQuAD:id:2525;What sports are played at institutes affiliated by the Association of Southeast Asian Institutes of Higher Learning?;Activity
urn:LCQuAD:id:693;Which board game can be said as a mind based game?;Activity
urn:LCQuAD:id:1569;Where were some people associated with Steve Winwood employed at?;Activity
urn:LCQuAD:id:2980;What sports are played at Vishwajyot High School?;Activity
urn:LCQuAD:id:937;Which non fiction of the Thud is also the field of the Jon Speelman ?;Activity
urn:LCQuAD:id:1444;What sports are played at universities affiliated by States Colleges and Universities athletic association?;Activity
urn:LCQuAD:id:1162;Name the sports played by Jamiatu Muslim Mindanao?;Activity
urn:LCQuAD:id:4099;What did other artists associated with the Shirelles make?;Activity
urn:LCQuAD:id:156;What are the kind of games one can play on windows?;Activity
urn:LCQuAD:id:2603;Name the common sports played at Polytechnic University of Philippines San Juan and Islamic Azad University?;Activity
urn:LCQuAD:id:1732;Of the sports commonly played at Islamic Azad Uni, tehran, which one does Jon Speelman play?;Activity
urn:LCQuAD:id:2380;What sports are played in schools in Vashi?;Activity
urn:LCQuAD:id:865;What sport has made Eric Schiller famous, and has employed Craig Van Tibury?;Activity
urn:LCQuAD:id:3298;What do craig Van tilbury and karen Grigorian do for a living?;Activity
urn:LCQuAD:id:4829;Where the children of Ashot Grashi employed at?;Activity
urn:LCQuAD:id:3371;What is the occupation of the band members of The Shirelles?;Activity
urn:LCQuAD:id:2440;Which job of Irving Chernev is the non-fiction subject of the Thud ?;Activity
urn:LCQuAD:id:4048;List the sports played in private universities.;Activity
urn:LCQuAD:id:2649;What sport is Eric Schiller known for, and employes Craig Van Tibury?;Activity
urn:LCQuAD:id:3536;What sport played in Polytechnic uni of San Juan has also made advocate nasiruddin famous?;Activity
urn:LCQuAD:id:3837;Which sports exist in the universities whose president is Emanuel de Guzman?;Activity
urn:LCQuAD:id:2068;Which athletics of Jaimatu Muslim Mindano is same as the genre of the Fritz Chess ?;Activity
urn:LCQuAD:id:3691;What are the common sports played by jamiatu Muslim mindanao and Polytechnic University of Philippines Taguig ?;Activity
urn:LCQuAD:id:359;What is common between sports played at Fr Agnel School and Jr college, and the genre of Virtual Kasparov?;Activity
urn:LCQuAD:id:892;What are the things Eric Schiller known for ?;Activity
urn:LCQuAD:id:1297;What games can be played in schools founded by Fr. Orlando?;Activity
urn:LCQuAD:id:3619;What kind of games does Blizzard games develop?;Activity
urn:LCQuAD:id:148;what are some common games played at both Fr Agnel Multipurpose School and Vishwajyot High School?;Activity
urn:LCQuAD:id:2653;What is the river whose mouth is in deadsea?;Place
urn:LCQuAD:id:589;What is the region of Tom Perriello ?;Place
urn:LCQuAD:id:3351;In which part of the world can i find Xynisteri and Mavro?;Place
urn:LCQuAD:id:4615;In which countries can i find some feminist writers?;Place
urn:LCQuAD:id:79;Where is the swedish covenant hospital?;Place
urn:LCQuAD:id:931;Which country s largest city is Lima?;Place
urn:LCQuAD:id:1090;Where is Emmett Hughes from?;Place
urn:LCQuAD:id:4487;What is the layout of the cars similar to that of the Subaru Outback?;Place
urn:LCQuAD:id:3580;In which country is the Duong river?;Place
urn:LCQuAD:id:3591;Whose album is Haiti, I am sorry?;Place
urn:LCQuAD:id:3008;Which river s source place is Gloucestershire and mouth in North Sea?;Place
urn:LCQuAD:id:4624;Name the regions served by Toll Global Express ?;Place
urn:LCQuAD:id:2886;What is the protected area whose nearest city is Kenya?;Place
urn:LCQuAD:id:2483;Where are Solidus and Aureus used?;Place
urn:LCQuAD:id:3789;What is the nationality of the chancellor who was served by Michael Mayr?;Place
urn:LCQuAD:id:691;List the ceremonial county of East Tilbury ?;Place
urn:LCQuAD:id:1321;List everything governed by the Democratic Party of US?;Place
urn:LCQuAD:id:1782;Which home stadium of 2011-12 FC Spartak Moscow season is also the location of birth of the Svetlana Gounkina ?;Place
urn:LCQuAD:id:4118;Where is the stadium of Philadelphia Rage ?;Place
urn:LCQuAD:id:2016;What is the resting place of the politician who succeeded Samuel Hayes?;Place
urn:LCQuAD:id:2584;What is the state of the administrative region where Oscoda, Michigan is located?;Place
urn:LCQuAD:id:2727;Where do bachelor of arts live?;Place
urn:LCQuAD:id:1293;List the awards given to the race horses bred by Willis Sharpe Kilmer.;Place
urn:LCQuAD:id:3523;Name the parts of the settlements which has New Braunfels as one of the parts ?;Place
urn:LCQuAD:id:2809;What is the death location of the scientist who is the known authority of Hallopus ?;Place
urn:LCQuAD:id:1397;Which state s largest city is Omaha?;Place
urn:LCQuAD:id:2948;Name the tiemzone of Banlung ?;Place
urn:LCQuAD:id:3001;What are some seas inside europe ?;Place
urn:LCQuAD:id:3928;What countries used Solidus as currency?;Place
urn:LCQuAD:id:1108;Which source of broad creek is the Audenried tunnel located ?;Place
urn:LCQuAD:id:2423;What is the river that falls into North Sea and Thames Estuary?;Place
urn:LCQuAD:id:4281;Which range of mountains are there in canton of Fribourg?;Place
urn:LCQuAD:id:3066;Where did the film director of Kala Pani die?;Place
urn:LCQuAD:id:2317;What is the Ceremonial County of Port of Tilbury ?;Place
urn:LCQuAD:id:4741;Name the part of Liverpool city region >;Place
urn:LCQuAD:id:2110;What are the source of the streams whose one of the source is Calera, Oklahoma?;Place
urn:LCQuAD:id:4587;Name the river mouth of Moordener Kill ?;Place
urn:LCQuAD:id:233;What railway lines go through the stations maintained by Western Australian Public Transport Authority?;Place
urn:LCQuAD:id:4192;Name some local authorities of schools which have a mixed gender education system?;Place
urn:LCQuAD:id:803;Name the serving line of Daund Junction railway station?;Place
urn:LCQuAD:id:4190;What is the county seat of the district through which the Beckler River flows?;Place
urn:LCQuAD:id:1135;Which wine region of Bogdanua is the Croatian Inline hockey team part of ?;Place
urn:LCQuAD:id:3604;From where does the river start, which flows into the Conowingo dam?;Place
urn:LCQuAD:id:765;Name the home town of Cline Buckens ?;Place
urn:LCQuAD:id:2460;List all the wine regions of the grapes whose one of the wine region is Mississippi ?;Place
urn:LCQuAD:id:3137;Which citys mayor is anne hidalgo?;Place
urn:LCQuAD:id:3526;name the home stadium of FC Spartak Moscow season 2011-12;Place
urn:LCQuAD:id:3692;Among the countries using Aureus as currency which had Nicomedia as an important place ?;Place
urn:LCQuAD:id:1244;What is the style of architecture of Pontiac Building ?;Place
urn:LCQuAD:id:2347;Where did the conflict take place in which Henri Putz fought?;Place
urn:LCQuAD:id:2119;List all crafts of the people whose one of the profession is Kingdom of Naples ?;Place
urn:LCQuAD:id:3819;Matthew kane and Park rankin are citizens of which country?;Place
urn:LCQuAD:id:3927;What is the county seat of the county which has an Evergreen High School?;Place
urn:LCQuAD:id:3259;Through which states does the road go, which has a junction on Keningston Maryland?;Place
urn:LCQuAD:id:1168;Name the river passing through Reading Berkshire and has mouth place at Essex ?;Place
urn:LCQuAD:id:4870;Which city is the route start of the Moscow-Kazan high-speed railway and birth place of the Ilya Savelev ?;Place
urn:LCQuAD:id:2685;Where did the people beatified by Pope Pius X die?;Place
urn:LCQuAD:id:4650;Where did the people die who were known for Young Life?;Place
urn:LCQuAD:id:2498;List the home town of the people who have Ontario as one of it ?;Place
urn:LCQuAD:id:3331;Name the wine regions of Bogdanua ?;Place
urn:LCQuAD:id:4667;What are on the borders of Shimsa Plateau?;Place
urn:LCQuAD:id:2602;What are the bridges whose located in California?;Place
urn:LCQuAD:id:4023;Which settelment area is the home town of the Danny Felice and Cline Buckens?;Place
urn:LCQuAD:id:1557;Which division of Serbia national team is also the region of Dobinsk Ice Cave ?;Place
urn:LCQuAD:id:3646;List the destination of Novair International Airways ?;Place
urn:LCQuAD:id:3148;Name the river with source as Columbia Lake and river mouth is located in Clatsop Country ?;Place
urn:LCQuAD:id:2732;What is the layout of Subaru Legacy (second generation) ?;Place
urn:LCQuAD:id:2970;Name the city with leader as Esther Alder and neighboring municipality as Pregny-Chambsy?;Place
urn:LCQuAD:id:2274;Name the kingdom with currency Solidus (coin) and administrative headquarters in Nicomedia?;Place
urn:LCQuAD:id:4921;Name the river whose mouth place is Old Lyme, Connecticut?;Place
urn:LCQuAD:id:4916;What are the things whose leader was a monarch of Willem-Alexander of the Netherlands?;Place
urn:LCQuAD:id:166;Rivers from which countries flow into the Caspian?;Place
urn:LCQuAD:id:1751;Which is the nearest city to Elliott Bay ?;Place
urn:LCQuAD:id:1129;What is the municipality of Patterson Houses ?;Place
urn:LCQuAD:id:211;What are the border of High Desert (Oregon)?;Place
urn:LCQuAD:id:3997;What is the location city of Burnside Distribution Corporation ?;Place
urn:LCQuAD:id:3683;Name the river with mouth palce Essex and source place as Gloucestershire ?;Place
urn:LCQuAD:id:790;What are the resting places of the associates of John Betts a, Connecticut politician?;Place
urn:LCQuAD:id:2910;Which peak was first scaled by Krzysztof Wielicki?;Place
urn:LCQuAD:id:1818;List the state of the universities whose nation is United States ?;Place
urn:LCQuAD:id:4176;What is the nationality of Sune Agerschou ?;Place
urn:LCQuAD:id:2244;What is the military rank of the important commander of Peruvian Army?;Place
urn:LCQuAD:id:3153;Name the sovereign state of Wallington railway station ?;Place
urn:LCQuAD:id:1665;Where does the Giannis Alafouzos originate?;Place
urn:LCQuAD:id:945;What is the birth city of the Salford City F.C players ?;Place
urn:LCQuAD:id:4697;Who are the maintainers of the bridges which cross the pandaruan river?;Place
urn:LCQuAD:id:4141;What is the broadcast area of CFRX ?;Place
urn:LCQuAD:id:1740;Which destination of the Novair International Airways is also the  predecessor of the Chevrolet Caprice?;Place
urn:LCQuAD:id:2447;Name the city of Duwamish River ?;Place
urn:LCQuAD:id:1113;Where was the Temptation Waits recorded?;Place
urn:LCQuAD:id:2092;What is the state of origin of Abbas Jafri ?;Place
urn:LCQuAD:id:2945;Which river has its roots in Baikal Mountains?;Place
urn:LCQuAD:id:1935;List the countries through which European rout E39 and E8 passes ?;Place
urn:LCQuAD:id:4454;Name the mountain which belongs to Sierra Nevada range and is located in Inyo National Forest?;Place
urn:LCQuAD:id:1595;What is the state of the settlement, which is the sub assembly of Mohamedia, Tunisia ?;Place
urn:LCQuAD:id:3652;Where is the football team located in which Josh Bell did his debut?;Place
urn:LCQuAD:id:3475;What is the ethicity of Ted Falon?;Place
urn:LCQuAD:id:2879;Name the river whose mouth mountain is Essex and river mouth is North Sea?;Place
urn:LCQuAD:id:1891;What is the death place of the Marina Pankova and Viktor Ulyanich?;Place
urn:LCQuAD:id:2021;What is the source country of reg Lake ?;Place
urn:LCQuAD:id:2577;Who operates the Ganz UV?;Place
urn:LCQuAD:id:2238;Where has GARAGE recorded its singles?;Place
urn:LCQuAD:id:576;Which railway line goes through the stations which are a part of the North Caucasus railway?;Place
urn:LCQuAD:id:1180;Name the source Island of Bayou ?;Place
urn:LCQuAD:id:888;What location country of AH141 is also the nation of malaysia Junior hockey league ?;Place
urn:LCQuAD:id:1777;Which river flows through both eastern and western washington?;Place
urn:LCQuAD:id:2409;List the language of Kunsten Museum of moder art Aalborg ?;Place
urn:LCQuAD:id:4352;Who is the predecessor of Voere ?;Place
urn:LCQuAD:id:4512;Which city is Black Grape Global located ?;Place
urn:LCQuAD:id:3012;Where was Henri, Duke of Rohan laid to rest?;Place
urn:LCQuAD:id:4541;Name the common serving line of Daund Junction railway station and Ujjain Junction railway station?;Place
urn:LCQuAD:id:3479;What is the county seat of Moscow Governorate ?;Place
urn:LCQuAD:id:2034;List borders of the admin region bordering Arctic ocean ?;Place
urn:LCQuAD:id:1022;What is the nationality of the J. T. Krogh which is also the  sovereign state of the Camilla Martin;Place
urn:LCQuAD:id:3121;Name the river whose source place is Gloucestershire and mouth place is Southend-on-Sea ?;Place
urn:LCQuAD:id:2005;Which cities have the river one of whose Tributary is the Missouri s big spring?;Place
urn:LCQuAD:id:266;List the awards won by the fashion designer which have been recognized by Tennessee State Museum ?;Place
urn:LCQuAD:id:2366;Where can I find companies which originated in Canada?;Place
urn:LCQuAD:id:3896;Where is the T.I. Ahmadiyya Girls Senior High School?;Place
urn:LCQuAD:id:1627;To what region is Sukhumbhand Paribatra, a leader?;Place
urn:LCQuAD:id:2873;What are the birth place of the people who are the star of Dhoondte Reh Jaaoge?;Place
urn:LCQuAD:id:4386;Which mountains are contained in Inyo National Forest?;Place
urn:LCQuAD:id:1188;Where are the homestadiums of the seasons chaired by Merritt Paulson?;Place
urn:LCQuAD:id:2080;What is the architecture of First National Bank and Trust Building (Lima, Ohio) ?;Place
urn:LCQuAD:id:76;Which country has given citizenship to both saima chowdhury and edmund john?;Place
urn:LCQuAD:id:2314;What is a salthill?;Place
urn:LCQuAD:id:1703;Where does the Jerusalem Institute of Justice render their services?;Place
urn:LCQuAD:id:1844;What borders siberia?;Place
urn:LCQuAD:id:910;What is the region of the successor of Mr. Jerome B. Chaffee ?;Place
urn:LCQuAD:id:3516;what mountains are in sierra nevada?;Place
urn:LCQuAD:id:2705;What is the river which comes from Southend-on-Sea mountain?;Place
urn:LCQuAD:id:3308;Name the capital of Barony of Caux ?;Place
urn:LCQuAD:id:4944;Rivers which end in Arkansas go through which cities?;Place
urn:LCQuAD:id:3852;What is the country of origin of the president of Skai group?;Place
urn:LCQuAD:id:4110;What are the important buildings of the architect whose one of the significant building is Krasnye Vorota?;Place
urn:LCQuAD:id:102;Which country s leader is David Johnston?;Place
urn:LCQuAD:id:4422;List education institute of the engineers whose alma mater is ChristChurch ?;Place
urn:LCQuAD:id:2025;The successor of Ellsworth Bunker belongs to which religion?;Place
urn:LCQuAD:id:396;Which rivers start in Wyoming?;Place
urn:LCQuAD:id:2552;In which mountain range does the Rochers De Naye lie?;Place
urn:LCQuAD:id:1800;King crimson has been recorded in which places?;Place
urn:LCQuAD:id:2437;what are some neighboring cities of Pregny Chambsy?;Place
urn:LCQuAD:id:2333;Through which counties does the road go which starts at the Port Klang?;Place
urn:LCQuAD:id:3164;What is the second track list of Dschinghis Khan (song) ?;Place
urn:LCQuAD:id:3760;What is the capital of the region which maintains the South Park Bridge ?;Place
urn:LCQuAD:id:4213;AH141 highway is a part of which country?;Place
urn:LCQuAD:id:3933;Which ceremonial County of the East Tilbury is also the local authority of the Buckhurst Hill County High School ?;Place
urn:LCQuAD:id:3311;List the launch site of the rockets whose one of the launch site has been Cape Canaveral Air Force Station Launch Complex 26 ?;Place
urn:LCQuAD:id:1490;Where is the county seat of King County, Washington?;Place
urn:LCQuAD:id:4746;Where is the tomb of son of Bruce Lee?;Place
urn:LCQuAD:id:4157;Which country were the people from who became famous for the Ramon Mangsaysay Award?;Place
urn:LCQuAD:id:178;Name the major shrine of Bogumilus?;Place
urn:LCQuAD:id:4466;What are the other launch site of the rockets which also have been launched from  Cape Canaveral Air Force Station Launch Complex 5 ?;Place
urn:LCQuAD:id:2627;Danny Felice, the Gibraltarian guitarist is from which city?;Place
urn:LCQuAD:id:658;Name the rivers originating from an English speaking nation?;Place
urn:LCQuAD:id:1088;In which region was political figure Wayne Allard elected?;Place
urn:LCQuAD:id:4500;Which county seats are in the district where I can find the Hylebos Creek?;Place
urn:LCQuAD:id:4640;Which largest city of Salsette Island is also the largest city of India ?;Place
urn:LCQuAD:id:2743;Which operator of ganz UV is also the nationality of the Gza Horvth ?;Place
urn:LCQuAD:id:3739;Name the other wine region of the grapes whose one of the wine region is Michigan?;Place
urn:LCQuAD:id:3781;Which administrative region leader is Sukhumbhand Paribatra and was founded by  Rama I?;Place
urn:LCQuAD:id:2288;Name the largest city of the country where the body of Amit Saigal was discovered?;Place
urn:LCQuAD:id:3355;Collect and return a list of things in the area where Spanish language is used?;Place
urn:LCQuAD:id:2697;Where did Wallace Dollase die?;Place
urn:LCQuAD:id:1683;In which state is Red Willow Creek?;Place
urn:LCQuAD:id:155;What is the nation of the speedway league where Ikaros Smederna played?;Place
urn:LCQuAD:id:4641;Which route start of Moscow-Kazan high-speed railway is the home stadium of 2011-12 FC Spartak Moscow ?;Place
urn:LCQuAD:id:930;in which country does the river end which originates in Lebrsnik?;Place
urn:LCQuAD:id:3291;List the mountains of the range Sierra Nevada (U.S.) located in  California?;Place
urn:LCQuAD:id:3318;Name the home ground of  2015 Fort Lauderdale Strikers season ?;Place
urn:LCQuAD:id:4777;Where are the cooper mountain vineyards and Mt. bachelor ski area located?;Place
urn:LCQuAD:id:246;Rashid Behbudov State Song Theatre and Baku Puppet Theatre can be found in which country?;Place
urn:LCQuAD:id:2810;Artists trained at art students league NY are buried where?;Place
urn:LCQuAD:id:923;What is the municipality of Liberty Bell ?;Place
urn:LCQuAD:id:4549;What does the river end on whose border we find in Bjelasnica?;Place
urn:LCQuAD:id:2406;What is the state of origin of Thomas Pfyl ?;Place
urn:LCQuAD:id:3189;Which mainter of  Cheasty Boulevard South is also the county seat of the King County, Washingtonsu ?;Place
urn:LCQuAD:id:3980;What are the largest cities in each of the destinations of TranStar Airlines?;Place
urn:LCQuAD:id:1749;What is the citizenship of Erastus Wiman ?;Place
urn:LCQuAD:id:2671;List the birthplace of the medicians who studied in Harvard.;Place
urn:LCQuAD:id:343;Which river ends at  Thames Estuary and North Sea?;Place
urn:LCQuAD:id:3139;What is the division of Serbia national American football team ?;Place
urn:LCQuAD:id:1517;Which rivers start at the Brower s Spring?;Place
urn:LCQuAD:id:4406;Who is the builder of Presidio Santa Cruz de Terrenate ?;Place
urn:LCQuAD:id:176;What is the largest city in the country where the San Marcos River originates?;Place
urn:LCQuAD:id:2459;List all the settlements which has a part named Seguin,Texas ?;Place
urn:LCQuAD:id:2208;In which state is Colemanville Covered Bridge located ?;Place
urn:LCQuAD:id:2189;List all the major shrines of the saints which has one of the shrines as Debre Libanos ?;Place
urn:LCQuAD:id:4065;Through which important cities the does the river originating from the Duwamish, flow?;Place
urn:LCQuAD:id:3674;List all the operators of the train who operates in Budapest ?;Place
urn:LCQuAD:id:2533;What is the territory of the conflict whose commander is Feng Zicai?;Place
urn:LCQuAD:id:1070;Which is the common nation of Louisa Hill and American Football Wellington from?;Place
urn:LCQuAD:id:4133;In which state is Goose Lake Valle, which is also part of Lava River Cave ?;Place
urn:LCQuAD:id:1373;What is the local authority of Liverpool Institute High School for Boys ?;Place
urn:LCQuAD:id:3539;Which countries were led by Pietro Parolin?;Place
urn:LCQuAD:id:1124;Where does the rail route, which ends at the Moskovsky station, begins?;Place
urn:LCQuAD:id:1778;What is the nationality of the golf player who won the  2002 Players Championship ?;Place
urn:LCQuAD:id:2698;Where did the people canonized by John Paul II die?;Place
urn:LCQuAD:id:22;What is the operator of SR class 3Sub ?;Place
urn:LCQuAD:id:4019;Which river flows through Central Washington?;Place
urn:LCQuAD:id:2230;What is the river whose origin is North-Western Province, Zambia?;Place
urn:LCQuAD:id:962;Who are the tenants of MasterCard Centre?;Place
urn:LCQuAD:id:2823;Which adminstrative region of Lawrence F. Cafero is also the resting place of Samuel Keeler ?;Place
urn:LCQuAD:id:1414;which planet was discovered by Urbain Le Verrier?;Place
urn:LCQuAD:id:4412;Which broad cast area od CFRX is the country of North America Poker Tour ?;Place
urn:LCQuAD:id:1731;Where did Steve Romeo dies ?;Place
urn:LCQuAD:id:702;Where are INKAS located which is also the state of origin for Jojo Chintoh ?;Place
urn:LCQuAD:id:496;Where did Fort Lauderdale Strikers season of 16 take place?;Place
urn:LCQuAD:id:2112;What is the serving railway line of Rostov-Glavny ?;Place
urn:LCQuAD:id:399;What country is Jeffrey Werleman from, which also has the American Mediterranean Sea?;Place
urn:LCQuAD:id:1352;List the maintainers of Pandaruan Bridge?;Place
urn:LCQuAD:id:1811;Name the sstadium of 2015 Pro Duta FC season ?;Place
urn:LCQuAD:id:3613;Which country has leaders  Karu Jayasuriya and Ranil Wickremesinghe?;Place
urn:LCQuAD:id:261;What is the route junction of Rhode Island Route 15 ?;Place
urn:LCQuAD:id:2825;What is the mouth mountain of Current River (Missouri) ?;Place
urn:LCQuAD:id:3046;Where is the tombstone of the parliament members who served with James Roberts as the Vice President, US?;Place
urn:LCQuAD:id:1766;Where is the ground of the soccer club, which has Alan Kusov as a team member ?;Place
urn:LCQuAD:id:1423;Where is the radio broadcasted in, whose sister station is CKFM-FM?;Place
urn:LCQuAD:id:4015;Where is the mouth of the river whose tributary is Bjelimićka  Rijeka ?;Place
urn:LCQuAD:id:1735;What is the birth location of the pope who was canonized by Agatha of Sicily?;Place
urn:LCQuAD:id:3158;Which destination of the Novair International Airway is the source origin of Spaghetti squash ?;Place
urn:LCQuAD:id:707;Name the mouth country of Upper Neretva ?;Place
urn:LCQuAD:id:1376;Give me the places where people who worked in Church of England died in ?;Place
urn:LCQuAD:id:4913;Which assembly of the Plymouth Savoy is the route end of the NorthSouth Transport Corridor?;Place
urn:LCQuAD:id:3442;What water bodies are nearest to Helsinki city?;Place
urn:LCQuAD:id:3292;Where did Marvo originate?;Place
urn:LCQuAD:id:440;What river ends in Indian Ocean and also starts somewhere in Zambia?;Place
urn:LCQuAD:id:3058;Which source of river Raa is the sovereign state of Adriatic sea ?;Place
urn:LCQuAD:id:482;List the shrines of the saint whose one of the shrine is Ponza ?;Place
urn:LCQuAD:id:3929;In which areas can I find wine made of Vitis vinifera grapes?;Place
urn:LCQuAD:id:3621;Which expertise of the Menetries s warbler is the  nationality of the Jeyhun Abiyev ?;Place
urn:LCQuAD:id:3541;Where does the road starting from Madison, Wisconsin end?;Place
urn:LCQuAD:id:2206;In which common territory did Sino French war and the Tonkin campaign take place?;Place
urn:LCQuAD:id:4560;In all the states which have a Uniontown, where does a Keller s mill covered bridge exist too?;Place
urn:LCQuAD:id:4834;What is the style of architecture of Shaheed Minar, Kolkata ?;Place
urn:LCQuAD:id:3610;In which timezone does Khok Kwang lie?;Place
urn:LCQuAD:id:140;Where are Aureus and Solidus used as currency?;Place
urn:LCQuAD:id:2446;What are the mountains in the Sequoia National Park?;Place
urn:LCQuAD:id:3483;Cricket is played by which countries  citizens?;Place
urn:LCQuAD:id:4497;Name the route start of Saint Petersburg  Moscow Railway ?;Place
urn:LCQuAD:id:4825;Which river goes through cohoes, NY;Place
urn:LCQuAD:id:1987;Which country are the players of the Atletico Petroleos de Luanda from?;Place
urn:LCQuAD:id:2358;In which nation does the league take place where C.D. Primeiro de Agosto play?;Place
urn:LCQuAD:id:1381;What is the largest city of the country which have an assembly of Plymouth Savoy?;Place
urn:LCQuAD:id:1364;In which municipalities does the NYC housing authority own buildings?;Place
urn:LCQuAD:id:307;What city is the residence of Cheryl Teigs?;Place
urn:LCQuAD:id:1317;Where is the  assembly of Caterpillar 797 ?;Place
urn:LCQuAD:id:1239;What are the county seats of the region which operates the Boeing Field?;Place
urn:LCQuAD:id:2289;Where is the hometown of A Bartlett Giamatti?;Place
urn:LCQuAD:id:4026;What is the home town of the Band which is the previous work of Sammy Hagar & Friends ?;Place
urn:LCQuAD:id:3519;Name the wine regions of Baco noir?;Place
urn:LCQuAD:id:1307;What is the citizenship of the Sarah Kazemy and land of the Cervelle de canut;Place
