question;questionText;type
urn:LCQuAD:id:997;Is Lloyd  Nosler the editor of The Temptress?;Boolean
urn:LCQuAD:id:4750;Was the USS Tillamook built in Seattle?;Boolean
urn:LCQuAD:id:2488;Is Steve Nash the chairman of Vancouver Whitecaps FC?;Boolean
urn:LCQuAD:id:2281;Do Ctenochaetus Binotatus lie in the cActinopterygii class?;Boolean
urn:LCQuAD:id:1053;Was the altazor drawn by Picasso?;Boolean
urn:LCQuAD:id:2285;Does Stanley Cavell study Shakespeare?;Boolean
urn:LCQuAD:id:4043;Does Beth Tweddle play for the City of Liverpool gymnast club?;Boolean
urn:LCQuAD:id:2398;Does the hudson river flow into the lower manhatten?;Boolean
urn:LCQuAD:id:4041;Was tupac a member of Outlawz?;Boolean
urn:LCQuAD:id:2855;Is Another Lonely Night in New York by the musical band Robin Gibb?;Boolean
urn:LCQuAD:id:2658;Did chris lebenzon edit Batman returns?;Boolean
urn:LCQuAD:id:2279;Is the assembly of tofa ahin ethopia?;Boolean
urn:LCQuAD:id:2598;Was the street dogs of south central narrated by Queen Latifah?;Boolean
urn:LCQuAD:id:4789;Was Citizen Kane cinematographed by Gregg Toland?;Boolean
urn:LCQuAD:id:1549;Did Stan Lee create the Iceman comics?;Boolean
urn:LCQuAD:id:1382;Does nintendo have a division called Nintendo Entertainment Planning & Development?;Boolean
urn:LCQuAD:id:4314;Does Walson Augustin play for the Brothers Union?;Boolean
urn:LCQuAD:id:4082;Was Zachary Taylor a commander of the sixth infantry regiment of US?;Boolean
urn:LCQuAD:id:3992;Does Walson Augustin play as a midfielder?;Boolean
urn:LCQuAD:id:1805;Is Sao Paulo the largest city of Brazil?;Boolean
urn:LCQuAD:id:4630;Is PIAS Recordings the distributing label of Wichita Recordings?;Boolean
urn:LCQuAD:id:3453;Was Gerald Gibbs the cinematographer of X the unknown?;Boolean
urn:LCQuAD:id:560;Is Compaq a software company?;Boolean
urn:LCQuAD:id:2764;Does the owyhee river flow into oregon?;Boolean
urn:LCQuAD:id:3540;was the first national bank and trust building architectured by Chicago?;Boolean
urn:LCQuAD:id:4638;Did Tupac write the lyrics of Holler If Ya Hear Me?;Boolean
urn:LCQuAD:id:2102;Does the San Macros River start in Texas?;Boolean
urn:LCQuAD:id:2493;Is the national anthem of Mauritius motherland?;Boolean
urn:LCQuAD:id:3096;Did Jerry Siegel create Lois Lane?;Boolean
urn:LCQuAD:id:1232;Is Gaza Strip the result of Operation Autumn Clouds?;Boolean
urn:LCQuAD:id:3848;Is US Navy garrisoned at Arlington County, Virginia?;Boolean
urn:LCQuAD:id:1577;Is tahiti in the Society Islands achipelago?;Boolean
urn:LCQuAD:id:4126;Is Greg Weeks the band member of Beyond the Sixth Seal?;Boolean
urn:LCQuAD:id:1385;Was the Model K designed by Herny Ford?;Boolean
urn:LCQuAD:id:1798;Does Mt St. Peter Churt follow the architectural style of art deco?;Boolean
urn:LCQuAD:id:1286;Is Lancy a city close to Geneva?;Boolean
urn:LCQuAD:id:714;Is Ella Fitzgerald associated with Mickey Roker?;Boolean
urn:LCQuAD:id:3015;Does the lena river flow into the Laptev Sea?;Boolean
urn:LCQuAD:id:4833;Was Michael Schumacher the Pole driver of 1994 Spanish Grand Prix?;Boolean
urn:LCQuAD:id:42;Does the west thurrock come under Essex county?;Boolean
urn:LCQuAD:id:2830;Is Azerbaijan the membership of European Go Federation?;Boolean
urn:LCQuAD:id:1177;Does Massimo Liverani play for Abarth?;Boolean
urn:LCQuAD:id:1947;Does MSX BASIC have a license of microsoft?;Boolean
urn:LCQuAD:id:1624;Did Stan Lee write the Daredevils?;Boolean
urn:LCQuAD:id:1347;Was Yabanc Damat first aired in UAE?;Boolean
urn:LCQuAD:id:3731;Is Philosophy the academic discipline of Think (journal)?;Boolean
urn:LCQuAD:id:4002;The Information: A History, a Theory, a Flood is a work of Isaac Newton?;Boolean
urn:LCQuAD:id:128;Did Steve Sampson manage a club of Santa Clara university;Boolean
urn:LCQuAD:id:275;Did Henry Ford design the Model C?;Boolean
urn:LCQuAD:id:4585;Was Just Another day made by Queen Latifah?;Boolean
urn:LCQuAD:id:4689;Is Stephanie Rice the flagbearer of Australia at the 2008 Summer Olympics?;Boolean
urn:LCQuAD:id:3182;Did Carolyn Heinrich study at the Vanderbilt?;Boolean
urn:LCQuAD:id:1655;Was mother teresa beatified by John Paul the second?;Boolean
urn:LCQuAD:id:1801;Is william doyle the chairman of Georgetown university?;Boolean
urn:LCQuAD:id:27;Is north america one of the destinations of airtours airways?;Boolean
urn:LCQuAD:id:503;Is Audie Murphy buried in the Arlington national cementery?;Boolean
urn:LCQuAD:id:3427;Mazhar Ul Haq High School, Beerwah is affiliated to Islamic Religion;Boolean
urn:LCQuAD:id:403;Is Tea the main ingredient of Lahpet?;Boolean
urn:LCQuAD:id:548;Is michelangelo the painter of The Persian Boy?;Boolean
urn:LCQuAD:id:694;Was GM first aired in Albania?;Boolean
urn:LCQuAD:id:4008;was james watt a mechanical engineer?;Boolean
urn:LCQuAD:id:3529;Is Bluebird the grandsire of Miss Potential?;Boolean
urn:LCQuAD:id:1883;Was the song The Boy is Mine recorded in Atlanta?;Boolean
urn:LCQuAD:id:3041;Does Shaun Thong a member of Audi?;Boolean
urn:LCQuAD:id:142;Is the chestnut white bellied rat a mammal?;Boolean
urn:LCQuAD:id:3237;Does Sonny Bill Williams belong in the Canterbury Bankstown Bulldogs club?;Boolean
urn:LCQuAD:id:1;Was winston churchill the prime minister of Selwyn Lloyd?;Boolean
urn:LCQuAD:id:1695;Does Jean Louis Arcand work for Geneva?;Boolean
urn:LCQuAD:id:3450;Is facebook a public company?;Boolean
urn:LCQuAD:id:2043;Does Air 2000 fly to the north american continent?;Boolean
urn:LCQuAD:id:4530;Does Richard Marx play guitar?;Boolean
urn:LCQuAD:id:1963;Is Gutenberg neighbouring with Madiswil?;Boolean
urn:LCQuAD:id:348;Does Mr. Jim s Pizza operate in the pizza industry?;Boolean
urn:LCQuAD:id:3328;Does the Jordan River start in the Golan Heights?;Boolean
urn:LCQuAD:id:83;Was Reza Amrollahi born in Iran?;Boolean
urn:LCQuAD:id:973;Does the croton river flow into the hudson?;Boolean
urn:LCQuAD:id:3566;Did nokia 215 has the series 30+ OS?;Boolean
urn:LCQuAD:id:737;Was Tommy Tucker s Tooth animated by Walt Disney?;Boolean
urn:LCQuAD:id:2382;Was Johnny Depp a member of Skull Gang?;Boolean
urn:LCQuAD:id:3658;Is Hard Candy Fitness one of the divisions of Moscow?;Boolean
urn:LCQuAD:id:674;Is Truth prevails the national motto of Czechoslovakia?;Boolean
urn:LCQuAD:id:3758;Is Olyokma River the right tributary of Lena River?;Boolean
urn:LCQuAD:id:2129;Does Ronaldinho play in the brazil s under 23 team?;Boolean
urn:LCQuAD:id:3938;Was Class Conflict an interest of Karl Marx?;Boolean
urn:LCQuAD:id:1716;Is Akan spoken in Ghana?;Boolean
urn:LCQuAD:id:4129;Is Robin Gibb the singer of Oh! Darling?;Boolean
urn:LCQuAD:id:2863;Is the Chiva Bus by the Ford Motor Company?;Boolean
urn:LCQuAD:id:1591;Was the Funky Lab Rat released in North America?;Boolean
urn:LCQuAD:id:4768;Is Fluidinfo written in PostgreSQL language?;Boolean
urn:LCQuAD:id:3895;Did Johann Gottfried Galle invent Neptune?;Boolean
urn:LCQuAD:id:1640;Was Buzz Williams the headcoach of the Marquette Golden Eagles mens team?;Boolean
urn:LCQuAD:id:2030;Was saddam hussein at the rank of Mushir ever?;Boolean
urn:LCQuAD:id:849;Does Kirk Hammett play the Gibson Flying V?;Boolean
urn:LCQuAD:id:4617;Is Tamera Mowry the former band member of Voices?;Boolean
urn:LCQuAD:id:4876;Is Grand Bahama lie in the achipelago of the bahamas?;Boolean
urn:LCQuAD:id:771;Is Michael Schumacher the first driver of the 1994 grand prix?;Boolean
urn:LCQuAD:id:1463;Was Walt Disney the cinematographer of Mickey s Mellerdrammer?;Boolean
urn:LCQuAD:id:1914;Was Michael Schumacher a pole driver in the 1999 GP?;Boolean
urn:LCQuAD:id:4030;Is Ethics the main interests of Henry David Thoreau?;Boolean
urn:LCQuAD:id:1804;Was Elizabeth Ann Seton canonized by Pope Paul VI?;Boolean
urn:LCQuAD:id:1131;Was Gareth Southgate a manager of Middlesbrough F.C.?;Boolean
urn:LCQuAD:id:1372;Does the Sicklefin lemon shark belong in the animal kingdom?;Boolean
urn:LCQuAD:id:3587;Does the stylistic origins of Plena lie in the Caribbean?;Boolean
urn:LCQuAD:id:1039;Is the Bucyrus MT6300AC assembled in north america?;Boolean
urn:LCQuAD:id:3726;Was 2658 Gingerich invented in Harvard?;Boolean
urn:LCQuAD:id:1750;Does the Amazon River start in Arequipa Region?;Boolean
urn:LCQuAD:id:4837;Is San Salvador Island a part of the Bahamas?;Boolean
urn:LCQuAD:id:171;Is Queen Latifah associated with Afrika Baby Bam?;Boolean
urn:LCQuAD:id:4295;Is N. C. Wyeth the illustration by of The Mysterious Stranger?;Boolean
urn:LCQuAD:id:4629;Did James brown make the song Killing is Out, School Is In?;Boolean
urn:LCQuAD:id:4187;Is Robert Boyle a chemist?;Boolean
urn:LCQuAD:id:97;Did Gwo Ka originate in Western Africa?;Boolean
urn:LCQuAD:id:3028;Was Zachary taylor a major general?;Boolean
urn:LCQuAD:id:4248;Is the Journal of Cerebral Blood Flow and Metabolism about Brains?;Boolean
urn:LCQuAD:id:4039;Is the Caterpullar 797F assembled in North America?;Boolean
urn:LCQuAD:id:2541;Is The Universe in a Single Atom a book about buddhism?;Boolean
urn:LCQuAD:id:1301;Is Frontaccounting licensed under GNU license?;Boolean
urn:LCQuAD:id:1387;Is Queen Latifah the narrator of Arctic Tale?;Boolean
urn:LCQuAD:id:3452;Is Rajya Sabha a house of parliament in India?;Boolean
urn:LCQuAD:id:774;Does the asiana airlines fly into the Gimhae International Airport?;Boolean
urn:LCQuAD:id:4137;Is Roger Federer the flagbearer of Switzerland at the 2004 Summer Olympics?;Boolean
urn:LCQuAD:id:2490;Did Christian Barnard study in the University of Minnesota?;Boolean
urn:LCQuAD:id:1501;How many movies did Stanley Kubrick direct?;Number
urn:LCQuAD:id:705;How many races have the horses bred by Jacques Van t Hart participated in?;Number
urn:LCQuAD:id:228;How many people live in Wilton, Connecticut?;Number
urn:LCQuAD:id:4767;List the total number of board members who share board with Creative commons ?;Number
urn:LCQuAD:id:486;How many mammals are in the Chordate phylum?;Number
urn:LCQuAD:id:3078;How many things are aired on BBC HD?;Number
urn:LCQuAD:id:2633;Count all those whose youth club was managed by Luis Enrique.;Number
urn:LCQuAD:id:1413;In how many different places does Canal and River Trust own its assets?;Number
urn:LCQuAD:id:763;Count the total number of launch site of the rockets which have been launched form Cape Canaveral Air Force Station ?;Number
urn:LCQuAD:id:157;Count the number of sports played by schools which play hockey ?;Number
urn:LCQuAD:id:4740;How many awards have been given to screenwriters?;Number
urn:LCQuAD:id:3456;How many software run on operating system is Microsoft Windows?;Number
urn:LCQuAD:id:1973;How many different mascots are there of the NCAA teams?;Number
urn:LCQuAD:id:2974;How many other ingredient are there in the foods whihh have one of the ingredient as Potato ?;Number
urn:LCQuAD:id:2887;How many companies have launched their rockets from the Vandenerg Air base?;Number
urn:LCQuAD:id:2847;Foxconn makes how many things?;Number
urn:LCQuAD:id:144;In how many nations can I find dishes made of Shallot?;Number
urn:LCQuAD:id:841;How many other important things have been written by the creator of Stuart Alan Jones?;Number
urn:LCQuAD:id:1941;Count the nearest city to the historic palce whose one of the nearest city is Wisconsin ?;Number
urn:LCQuAD:id:100;Give me the total number of commander of the military conflicts whose commander is Roundhead (Wyandot).;Number
urn:LCQuAD:id:2804;How many places were ruled by Elizabeth II?;Number
urn:LCQuAD:id:1096;Give me a count of bacterias which belongs to Bacilli class?;Number
urn:LCQuAD:id:829;How many producers have worked for FremantleMedia productions?;Number
urn:LCQuAD:id:764;How many shows are made by Larry David?;Number
urn:LCQuAD:id:4328;How many architects are there who have made something used by Oakland athletics?;Number
urn:LCQuAD:id:2689;How many awards have royal designers for industry awardwinners got?;Number
urn:LCQuAD:id:3230;How many TV show has distributor located in Burbank California ?;Number
urn:LCQuAD:id:4077;How many people have parterned with the person choroegraphed by Catarina Lindgren in the past?;Number
urn:LCQuAD:id:877;Count all the things licensed as Software as a service.;Number
urn:LCQuAD:id:626;How many broadcast area of the television stations exists whose broadcast area is Rodrigues ?;Number
urn:LCQuAD:id:2223;Count the drinks originated in England.;Number
urn:LCQuAD:id:2217;What is the total number of other non-fiction subject of the books whose one of the subject is Racism?;Number
urn:LCQuAD:id:1491;How many relatives are there of the people who died in Germany?;Number
urn:LCQuAD:id:4605;How many mountain are there in Sierra Nevada range?;Number
urn:LCQuAD:id:4595;What is the total number of other characters of the plays whose characters is Robin (comics)?;Number
urn:LCQuAD:id:1634;What is the total number of other nearest countries to the lakes whose nearest countries is Uganda?;Number
urn:LCQuAD:id:3936;How many companies have developed cross platformed softwares?;Number
urn:LCQuAD:id:3268;How many titles were given to people who engaged in the Operation Dragoon?;Number
urn:LCQuAD:id:471;To how many places does the airlines fly, whose head office is located at the Gatwick Airport?;Number
urn:LCQuAD:id:4692; How many scientist have won an award by the society led by Venkatraman Ramakrishnan?;Number
urn:LCQuAD:id:1803;Count me all the video game distributor whose parent company is Warner Bros ?;Number
urn:LCQuAD:id:505;How many people have written stuff broadcasted on the Tokyo Broadcasting System?;Number
urn:LCQuAD:id:252;In how many  territories were the wars fought where Fusil Gras Mile 1874 were used?;Number
urn:LCQuAD:id:350;How many other field are there of the scientists whose one of the field is Mathematics ?;Number
urn:LCQuAD:id:1961;How many people currently play for the NYC FC?;Number
urn:LCQuAD:id:422;In how many other states do people live, whose languages are spoken in Nebraska?;Number
urn:LCQuAD:id:670;How many people have played for a club whose coach is Fred Hoiberg?;Number
urn:LCQuAD:id:3945;How many different organizations own the railway lines which are a part of Norfolk Southern Railway?;Number
urn:LCQuAD:id:4392;How many theme musics have been composed by Julian Gingell?;Number
urn:LCQuAD:id:2450;Give me a count of everything made by the company which offers electronical manufacturing too.;Number
urn:LCQuAD:id:1578;How many games have been composed by Hirokazu Tanaka?;Number
urn:LCQuAD:id:3106;For how many things are americans famous for?;Number
urn:LCQuAD:id:1175;How many things belong to a division of plant kingdom?;Number
urn:LCQuAD:id:1872;In how many different places can I find companies which were founded in toronto?;Number
urn:LCQuAD:id:3382;How many awards have the french people received?;Number
urn:LCQuAD:id:4415;How many bacterias have taxonomy as Bacillales and domain as Bacteria? ;Number
urn:LCQuAD:id:889;On how many subjects has Random house publishers published books?;Number
urn:LCQuAD:id:1588;How many dishes are made with an ingredient belonging to the flowering plant species?;Number
urn:LCQuAD:id:43;How many people have headed organizations headquartered at Niederkirchnerstrae?;Number
urn:LCQuAD:id:949;How many states does the Pioneer corporation operate in?;Number
urn:LCQuAD:id:478;How many other Guests are there of the television episodes whose Guests is Brian d Arcy James ?;Number
urn:LCQuAD:id:533;Count the total number of software whose programming language is C++ and operating system is Microsoft Windows?;Number
urn:LCQuAD:id:3607;What is the total number of politicians whose predecessor s deputy is Jenny Macklin?;Number
urn:LCQuAD:id:2648;How many managers have managed Middlesbrough FC?;Number
urn:LCQuAD:id:1983;Give me a count of bridges located in California ?;Number
urn:LCQuAD:id:3360;How many different genres led to other genres where drums are important?;Number
urn:LCQuAD:id:1391;How many companies were founded in Dallas?;Number
urn:LCQuAD:id:4885;From how many countries did the aeroplanes designed by Alexander Lippisch originate?;Number
urn:LCQuAD:id:4880;How many bands are signed up with Kobalt Label Services?;Number
urn:LCQuAD:id:4299;Count the different religions followed by Second Lieutenants in military.;Number
urn:LCQuAD:id:4566;How many publisher have been founded by american citizens?;Number
urn:LCQuAD:id:1662;How many other region served are there of the companies which serves  Pacific Ocean ?;Number
urn:LCQuAD:id:4246;How many countries surround the sea into which the Upper Neratva flow?;Number
urn:LCQuAD:id:2173;How many rivers end in the Indian Ocean?;Number
urn:LCQuAD:id:1412;How many artists  works are in Muse d Orsay?;Number
urn:LCQuAD:id:1340;Give me a count of everything owned by the network whose sister name is The CW?;Number
urn:LCQuAD:id:3464;How many awards have been given to the participants of the Lawrence Realization Stakes?;Number
urn:LCQuAD:id:3018;Count the different types of Flatbread ?;Number
urn:LCQuAD:id:4252;Count the birthplaces of recepients of the National Museum of Racing and Hall of Fame.;Number
urn:LCQuAD:id:751;How many companies serve the Australian region?;Number
urn:LCQuAD:id:4644;How many teams was Garry Unger in, previously?;Number
urn:LCQuAD:id:621;How many writers worked on the album Main Course?;Number
urn:LCQuAD:id:2181;What is the total number of other restingplace of the politicians whose one of the restingplace is East Norwalk Historical Cemetery?;Number
urn:LCQuAD:id:534;How many albums were released under the Victor Entertainment label?;Number
urn:LCQuAD:id:1049;In how many places can I find tombs of people who fought in the Norwalk Trainband?;Number
urn:LCQuAD:id:2052;How many saints have been venerated in Judaism?;Number
urn:LCQuAD:id:4888;How many people are famous for the Gibson Les Paul?;Number
urn:LCQuAD:id:511;Give me an estimate of the number of manufacturers whose products are managed by MTR?;Number
urn:LCQuAD:id:4729;How many artists play as Rickenbacker?;Number
urn:LCQuAD:id:4773;How many ingedients are required to make the Ragout Fin?;Number
urn:LCQuAD:id:2117;Tell me the number of writers whose works have been recorded in Criteria Studios?;Number
urn:LCQuAD:id:4011;How many owners are there of lines starting at the South Station?;Number
urn:LCQuAD:id:122;Count all those who ve played for the youth club which owns the Rosario, Santa Fe stadium.;Number
urn:LCQuAD:id:1871;How many people currently play for Stoke City F.C.?;Number
urn:LCQuAD:id:3185;How many cars succeeded the cars which were similar to Cadillac Fleetwood?;Number
urn:LCQuAD:id:1056;In how many languages did Marika Gombitova sing?;Number
urn:LCQuAD:id:856;How many railway lines go through the station maintained by Public transport authority of western australia?;Number
urn:LCQuAD:id:3838;Count the different number of academic areas covered by publications of SAGE?;Number
urn:LCQuAD:id:720;How many services does the company who made Onedrive provide?;Number
urn:LCQuAD:id:2710;Count the different religions practiced by people who are in the Malaysian and Chinese association.;Number
urn:LCQuAD:id:318;Eric roth wrote how many screenplays?;Number
urn:LCQuAD:id:4892;In how many places did the Schutzstaffels die?;Number
urn:LCQuAD:id:2934;How many members are there of the organization headquartered at Amstelveen?;Number
urn:LCQuAD:id:3725;Current players of Colorado Avalanche have previously played for how many different teams?;Number
urn:LCQuAD:id:756;Give me the total number of architect of the buildings whose one of the  architect was Louis D. Astorino?;Number
urn:LCQuAD:id:1173;List the total number of executive producer of TV show which have one of the executiive producer as Steven Moffat ?;Number
urn:LCQuAD:id:3616;How many religions have the relatives of waxiangs followed?;Number
urn:LCQuAD:id:1158;Count the total number of battles fought by the military people which fought in Levant ?;Number
urn:LCQuAD:id:2792;How many subjects have been covered in fantasy novels?;Number
urn:LCQuAD:id:4663;How many people have trained the wrestlers who were billed in Wisconsin?;Number
urn:LCQuAD:id:1504;In how many different places can I fnd Modern Architectural buildings?;Number
urn:LCQuAD:id:2418;Count the  origin of the beverages which have been originated in england /;Number
urn:LCQuAD:id:3986;Count the number of people became famous for when Andrew Jackson was a commander ?;Number
urn:LCQuAD:id:4559;In how many places are the tombs of everyone who died in England?;Number
urn:LCQuAD:id:3973;Count the different genres of music made by Argentinian bands?;Number
urn:LCQuAD:id:4361;How many famous people are from the Filipinos?;Number
urn:LCQuAD:id:1921;How many people have managed a club which owns the Riverside Stadium?;Number
urn:LCQuAD:id:4561;Count the religions followed by people living in British Columbia.;Number
urn:LCQuAD:id:4506;In how many districts is there a borough called tendring?;Number
urn:LCQuAD:id:4038;For everyone who died in paris, count their different fields of work.;Number
urn:LCQuAD:id:19;On how many different grounds were seasons chaired by Ronaldo held?;Number
urn:LCQuAD:id:1487;Give me a count of all ice hockey players whose teams are headcoached by John Tortorella?;Number
urn:LCQuAD:id:4174;How many leagues have used the O.co Coliseum?;Number
urn:LCQuAD:id:1018;Give me the count of all people who ascented a peak in California?;Number
urn:LCQuAD:id:1583;List the total number of regions of the building whose are located inGrand Forks Air Force Base?;Number
urn:LCQuAD:id:3350;Joe Shuster has created how many comics character ?;Number
urn:LCQuAD:id:4059;How many awards have graduates from the University of Queensland earned?;Number
urn:LCQuAD:id:3392;In how many nations does Rhaetian Railways own train stations?;Number
urn:LCQuAD:id:879;How many different kinds of games are published by Interplay Entertainment?;Number
urn:LCQuAD:id:3501;How many other important work has been done by the writers of Sarah Jane Adventures?;Number
urn:LCQuAD:id:3814;From how many works is the musical derived, whose lyrics are written by Sheldon Harnick?;Number
urn:LCQuAD:id:2456;How many non-fiction subject are there of the books whose one of the non-fiction subject is Ankh-Morpork City Watch ?;Number
urn:LCQuAD:id:2686;How many other family of the mammals exists  whose family is also Hominidae ?;Number
urn:LCQuAD:id:88;How many  TV shows were made by someone who was associated with Lewis Hamilton?;Number
urn:LCQuAD:id:457;For how many other teams have the former players of Boston Bruins played?;Number
urn:LCQuAD:id:3270;How many other important things has the painter of Sarah Jane Adventures done?;Number
urn:LCQuAD:id:239;Count the number of actors in Lucy Sullivan Is Getting Married.;Number
urn:LCQuAD:id:3022;The Other Side has hosted how many guests?;Number
urn:LCQuAD:id:1926;How many other wine region are there of the grapes whose one of the wine region is Michigan ?;Number
urn:LCQuAD:id:4676;Estimate the number of sports divisions at the universities under international association of universities.;Number
urn:LCQuAD:id:2776;Count all the books written by an author buried in the Convent of Barefoot Trinitarians?;Number
urn:LCQuAD:id:4915;Give me a count of mammals which have their order as Primate?;Number
urn:LCQuAD:id:1978;How many home stadiums are there of the seasons whose chairman in Merritt Paulson?;Number
urn:LCQuAD:id:2943;Count the number of first drivers in all the GPs where Mika Hakkinen was a first driver?;Number
urn:LCQuAD:id:31;How many tenats have been there, of the constructions of PCL constructures?;Number
urn:LCQuAD:id:309;Give me a count of everything under the archipelago, where Papeete is the biggest town.;Number
urn:LCQuAD:id:2251;How many titles have been won by the beauty queens which had brown hair?;Number
urn:LCQuAD:id:3290;Paul Leonard s work can be divided into how many series?;Number
urn:LCQuAD:id:289;Count the number of characters of the play whose one of the character is Catwoman ?;Number
urn:LCQuAD:id:188;Count the number of cities on the Mediterranean Sea?;Number
urn:LCQuAD:id:2157;Give me a count of the services by the company which provides Data center as the services ?;Number
urn:LCQuAD:id:2589;How many people were drafted in the LA Clippers?;Number
urn:LCQuAD:id:2095;Terry Pratchett has written about how many topics?;Number
urn:LCQuAD:id:708;In how many regions is English American spoken?;Number
urn:LCQuAD:id:3405;Give me the total number of Guests of the television episodes whose one of the  Guests is Michael Cristofer?;Number
urn:LCQuAD:id:1623;How many factions were fighting in the wars where Blue Jacket was a commander?;Number
urn:LCQuAD:id:3271;Count all the universities who participated in the tournament won by Alabama Crimson Tides in 2015 ?;Number
urn:LCQuAD:id:4221;How many players are in the San Francisco Giants?;Number
urn:LCQuAD:id:4369;How many races has Best Mate won?;Number
urn:LCQuAD:id:494;In how many different places have ehtics philosophers died?;Number
urn:LCQuAD:id:4812;How many companies have built concrete bridges?;Number
urn:LCQuAD:id:2402;How many movies have been directed by almunies of Parsons School of Design?;Number
urn:LCQuAD:id:3403;Count the number of  sport played by the school which also plays Association football ?;Number
urn:LCQuAD:id:1957;How many thesis were supervised by Ernest Rutherford?;Number
urn:LCQuAD:id:3603;From how many different places did the weapons used in the American Indian wars originate?;Number
urn:LCQuAD:id:1253;How many sports are played in maharashtran schools?;Number
urn:LCQuAD:id:3568;How many owners owned the clubs participating in the Premier leagues of  14?;Number
urn:LCQuAD:id:2728;How many people live in the Beverly Hills, California?;Number
urn:LCQuAD:id:1630;For how many movies have the music composer composed music, who have collaborated with Yes ?;Number
urn:LCQuAD:id:3554;In how many areas do the networks broadcast, which also broadcasts in North Carolina?;Number
urn:LCQuAD:id:2954;What is the total number of regions served by the companies which also serves Australia?;Number
