question;questionText;type
urn:LCQuAD:id:1464;Who is the operator of Rainbow Warrior (1955) ?;Agent
urn:LCQuAD:id:4568;Who was the chairman of Fort Lauderdale Strikers and also 2015 Fort Lauderdale Strikers season ?;Agent
urn:LCQuAD:id:204;Who were in the youth clubs that were in season of 2015 Argentine Primera Division?;Agent
urn:LCQuAD:id:162;What is the common school of Chris Marve and Neria Douglass?;Agent
urn:LCQuAD:id:617;What has been founded in the state that Denton county, Texas is a part of? ;Agent
urn:LCQuAD:id:3902;Into what military organizations is the United States Department of Defense divided?;Agent
urn:LCQuAD:id:4262;In which broadcast area does the sister station of KFFG air ?;Agent
urn:LCQuAD:id:4611;Which company owns instagram?;Agent
urn:LCQuAD:id:3075;List all the former partners of the figure skater whose one of the former partner was Andrea poapst ?;Agent
urn:LCQuAD:id:4809;Who has recorded their singles in London?;Agent
urn:LCQuAD:id:2097;Who are the associated musical artist of the  artists of band Shorty Rogers?;Agent
urn:LCQuAD:id:4357;Who were the american football players who played for Dallas Cowboys?;Agent
urn:LCQuAD:id:2481;People who debuted from Houston Astros have played in which clubs?;Agent
urn:LCQuAD:id:3050;Who  works  at the American Magazine and New York Post?;Agent
urn:LCQuAD:id:1019;What people are known to work for Johnny Cash?;Agent
urn:LCQuAD:id:1651;List the first drivers of Grand Prixes where Mika Hakkinen was a pole driver.;Agent
urn:LCQuAD:id:1337;Who are the people whose alumna is a part of the National Collegiate Athletic Association?;Agent
urn:LCQuAD:id:226;Who is the performer of album which has the song To Where You Are ?;Agent
urn:LCQuAD:id:3055;Who founded the city at the end of the Pittsburgh Line route?;Agent
urn:LCQuAD:id:1416;Who are some authoritative persons on the matter of Megabalanus concinnus?;Agent
urn:LCQuAD:id:3112;Which musical artists have collaborated with Waylon Jennings?;Agent
urn:LCQuAD:id:2789;Who made the Y block engine and the SHO V8 engine?;Agent
urn:LCQuAD:id:2183;Which tennis players live in Kenthurst, new south wales?;Agent
urn:LCQuAD:id:3210;who are some miss michigan usa?;Agent
urn:LCQuAD:id:597;Who are the associate musical artists of Dalma Kovcs ?;Agent
urn:LCQuAD:id:4031;Name the other party of Chandra Shekhar ?;Agent
urn:LCQuAD:id:3169;Which politicians live in a city led by T.S. Thakur?;Agent
urn:LCQuAD:id:521;What people were born in Ridgewood, New Jersey?;Agent
urn:LCQuAD:id:4539;Who is the appointer of Charles Goodell ?;Agent
urn:LCQuAD:id:3552;Name the Chris Marve s school ?;Agent
urn:LCQuAD:id:1511;Which military personnel belong to the branch of Continental Army?;Agent
urn:LCQuAD:id:2216;Name the office holders whose successor died in Morristown, New Jersey?;Agent
urn:LCQuAD:id:4343;Who studied in universities located in suburbs?;Agent
urn:LCQuAD:id:2415;List the relative of Tim Nanai-Williams ?;Agent
urn:LCQuAD:id:772;By which companies is RENFE Class 333 designed?;Agent
urn:LCQuAD:id:1674;Which Harris County based company is a subsidiary of Tandem Computers?;Agent
urn:LCQuAD:id:855;Which people are known for appearing on the television show Dragon s Den?;Agent
urn:LCQuAD:id:78;What university campuses are situated in Indiana?;Agent
urn:LCQuAD:id:4570;List some writers which speak one of the Germanic languages.;Agent
urn:LCQuAD:id:2176;Who voiced in Peanuts Motion Comics and The Peanuts Movie?;Agent
urn:LCQuAD:id:4726;Who founded a company which served Mid Wales ?;Agent
urn:LCQuAD:id:1459;Name some basketball players whose team is coached by Fred Hoiberg?;Agent
urn:LCQuAD:id:2803;Who are some US colonels?;Agent
urn:LCQuAD:id:4071;Who gave the musical score  of 9 to 5 (musical) ?;Agent
urn:LCQuAD:id:4333;Who are the spouse of the actors of Wrongfully Accused?;Agent
urn:LCQuAD:id:2452;Who is the vice president of Jared Bernstein ?;Agent
urn:LCQuAD:id:4078;Who is the monarch of Bertalan Szemere ?;Agent
urn:LCQuAD:id:421;Who is the performer of Bengali in Platforms ?;Agent
urn:LCQuAD:id:4973;Which company was the designer of South African class 11e and RENFE class 333 ?;Agent
urn:LCQuAD:id:3370;Who wrote the US steel hour?;Agent
urn:LCQuAD:id:389;List all the co-founders of the non for profit which have founding member as David pressman ?;Agent
urn:LCQuAD:id:542;Which company owns Evraz ?;Agent
urn:LCQuAD:id:2812;Who are the people who played for San Francisco 49ers?;Agent
urn:LCQuAD:id:2902;Name a famous relative of barry voight;Agent
urn:LCQuAD:id:3488;Who all have written songs that were then recorded in the Criteria Studios?;Agent
urn:LCQuAD:id:4317;Which educational institutes have campuses at Iowa and Indiana ?;Agent
urn:LCQuAD:id:4709;Who appointed William L. Dayton ?;Agent
urn:LCQuAD:id:3634;To which educational institutions did Lesli Sanchez go for her studies?;Agent
urn:LCQuAD:id:3939;What are some famous artists who rocked a Les Paul?;Agent
urn:LCQuAD:id:2877;Which company manufactured Delta III?;Agent
urn:LCQuAD:id:3077;Which band made the song Take me There, and has collaborated with Blayse in the past?;Agent
urn:LCQuAD:id:4623;Which person works at the American Magazine?;Agent
urn:LCQuAD:id:2401;Which royal people are buried in Rome?;Agent
urn:LCQuAD:id:2661;What artist was associated closely with the bare necessities and rock a doodle?;Agent
urn:LCQuAD:id:4100;Which parent company of the Cornell University Press is also the alma mater of the Mario Garca Menocal?;Agent
urn:LCQuAD:id:57;What company involved in the development of Sherlock did Arthur Levinson work for?;Agent
urn:LCQuAD:id:4104;Who was the president during the time the opponent of John Hospers was in the office?;Agent
urn:LCQuAD:id:2475;List the members of Skull Gang?;Agent
urn:LCQuAD:id:72;Who is the producer of the song which is the previous work of He s a Liar ?;Agent
urn:LCQuAD:id:743;Which publisher of Stone Canoe is also the university for which Michael Powell plays for ?;Agent
urn:LCQuAD:id:1546;Which current players once played for Toronto argonauts?;Agent
urn:LCQuAD:id:3038;To which senator did military unit VMF-155 belong?;Agent
urn:LCQuAD:id:4229;Name the first driver of 1999 San Marino Grand Prix ?;Agent
urn:LCQuAD:id:4974;What is the scientist whose doctoral students are Erich Bagge and erban ieica?;Agent
urn:LCQuAD:id:2691;List the relatives of the governor of Gabriel Slaughter?;Agent
urn:LCQuAD:id:3967;Who manufactured the Delta III and the Space Shuttle?;Agent
urn:LCQuAD:id:1671;What companies are located in toronto?;Agent
urn:LCQuAD:id:372;Name few companies founded in Texas?;Agent
urn:LCQuAD:id:788;To which military division does Clark Daniel Stearns belong?;Agent
urn:LCQuAD:id:4596;From where did Ben Wilson (American football) do his highscool?;Agent
urn:LCQuAD:id:3787;Where did Allama Matthews study?;Agent
urn:LCQuAD:id:2390;name the Glover s distributer ?;Agent
urn:LCQuAD:id:3965;Which team did Michael and Ryan Powell play for?;Agent
urn:LCQuAD:id:961;Who are the relatives of the character after which Quagmire s Quagmire was made?;Agent
urn:LCQuAD:id:2009;Which band was left by Kevin Jonas?;Agent
urn:LCQuAD:id:2338;Whose children died in North Bend, Ohio?;Agent
urn:LCQuAD:id:1354;Who were the producers of the tenderfoot?;Agent
urn:LCQuAD:id:2474;What are the organisation founded in Texas and Dallas?;Agent
urn:LCQuAD:id:1208;Which players have represented Los Angeles Angels of Anaheim?;Agent
urn:LCQuAD:id:3166;Who was the influencer of Dave Attel who also starred in Adios Amigo?;Agent
urn:LCQuAD:id:3470;Give me all martial artists trained by Joe Schilling.;Agent
urn:LCQuAD:id:1280;Name the musical band of Written in the Stars ?;Agent
urn:LCQuAD:id:629;Under whom did Charles Drummond Ellis do his PhD?;Agent
urn:LCQuAD:id:2334;Under which president did some politicians live in Kensington?;Agent
urn:LCQuAD:id:459;Who is the author of Karakuri Dji Ultimo ?;Agent
urn:LCQuAD:id:2113;Which company is located in Harris County, Texas?;Agent
urn:LCQuAD:id:4522;Which board memeber of jimmy Wales also owns Latvian Wikipedia ?;Agent
urn:LCQuAD:id:837;Which baseball team is managed by Bruce Bochy?;Agent
urn:LCQuAD:id:3206;What are the universities where athletics is regulated by National Collegiate Athletic Association?;Agent
urn:LCQuAD:id:1525;Who is the scientist whose academic advisor was Karl Ewald Hasse?;Agent
urn:LCQuAD:id:2381;Who owns the radio stations in Alabama?;Agent
urn:LCQuAD:id:4604;Which scientist is known for anthrax and has Karl Ewald Hasse as his academic advisor ?;Agent
urn:LCQuAD:id:1535;What is the owner of Ivanpah Solar Power Facility and the original developer of Dart?;Agent
urn:LCQuAD:id:955;What is the military branch of John Tower ?;Agent
urn:LCQuAD:id:4755;who is the husband of Rosie Huntington Whiteley?;Agent
urn:LCQuAD:id:3534;Who made the singles on the famous album Aida?;Agent
urn:LCQuAD:id:902;List all the former broadcast network of WMDN ?;Agent
urn:LCQuAD:id:444;What team has  players  born in Dominican Republic ?;Agent
urn:LCQuAD:id:754;Who was the opponent of Robert Carr, 1st Earl of Somerset ?;Agent
urn:LCQuAD:id:1989;Which saints were the messengers of Islam?;Agent
urn:LCQuAD:id:684;Which educational institution of Jack Mcgregor is also the alma mater of Donn barber ?;Agent
urn:LCQuAD:id:4342;Give me the list of people who scaled mountains in Sierra Nevada?;Agent
urn:LCQuAD:id:110;Where was David Scherman trained ?;Agent
urn:LCQuAD:id:1713;Who is the president when Loretta Ucelli used to work for Democratic party?;Agent
urn:LCQuAD:id:2821;Which prime ministers were served by the governor who appointed Murray Gleeson?;Agent
urn:LCQuAD:id:4781;Name the fictional character painted by Josh Friedman and portrayed in Terminator Genisys ?;Agent
urn:LCQuAD:id:4699;Which veterans served at CBS?;Agent
urn:LCQuAD:id:2169;Who attended Great Ayton university?;Agent
urn:LCQuAD:id:3954;List down all the baseball teams whose team manager was a Catcher?;Agent
urn:LCQuAD:id:213; Which musical band produced the subsequent work of City of New Orleans ?;Agent
urn:LCQuAD:id:3759;What is the debut team of the football player whose college is UCLA Bruins football?;Agent
urn:LCQuAD:id:4272;What are some employees of Uni of California, santa cruz?;Agent
urn:LCQuAD:id:1343;Which famous writer was married to Jill Krementz and had a son named Edith Vonnegut ?;Agent
urn:LCQuAD:id:1087;who all play for of the american football players at  Quarterback position?;Agent
urn:LCQuAD:id:4407;What team is famous for Robert Nederlander and also the debuting team of Gary Sanchez?;Agent
urn:LCQuAD:id:4263;In which companies boards do the writers of Wikitionary belong?;Agent
urn:LCQuAD:id:2246;Name the writer of South Park: The Stick of Truth ?;Agent
urn:LCQuAD:id:4752;Which automobile platform provider of Chiva bus is also the parent company of the Ford Falcon Cobra ?;Agent
urn:LCQuAD:id:3201;What team has Sam Keller and Jim McMilin played for?;Agent
urn:LCQuAD:id:703;Who wrote the frost king?;Agent
urn:LCQuAD:id:3341;Which company had built the rockets launched at the Cape Canaveral Air Force Station Space Launch Complex 17?;Agent
urn:LCQuAD:id:2257;Who trained the wrestlers who are billed in Wisconsin?;Agent
urn:LCQuAD:id:885;Which team did Bill Murphy and Jean Segura play for?;Agent
urn:LCQuAD:id:3395;Who had headed the governmental agencies whose admin HQ was in Niederkirchnerstrasse?;Agent
urn:LCQuAD:id:2412;Name a military unit whose command structure is United States Department of the Navy and garrison is Arlington County, Virginia?;Agent
urn:LCQuAD:id:2903;Which company developed both Dart and Go?;Agent
urn:LCQuAD:id:294;Which officers fought in the war of Siege of Fort Recovery?;Agent
urn:LCQuAD:id:1547;Which company builds Microsoft Azure and Microsoft Surface?;Agent
urn:LCQuAD:id:2012;return some  players who have played in the NBA?;Agent
urn:LCQuAD:id:425;What are some fictional characters whose voice is in the peanuts movie?;Agent
urn:LCQuAD:id:2400;What is the common university iof vanderbilt Commodores and also the college of hubert Wiggs ?;Agent
urn:LCQuAD:id:3796;Who is the writer with notable works like Adventures of Huckleberry Finn and The Adventures of Tom Sawyer?;Agent
urn:LCQuAD:id:3387;Through which label has Katy B released her singles?;Agent
urn:LCQuAD:id:913;Who first ascented a mountain of Cathedral Peak (California) ?;Agent
urn:LCQuAD:id:983;Which associated band of the Teddy Riley is also the performer of the Before I Let You Go?;Agent
urn:LCQuAD:id:3332;In which company is Raymond Conner at an important position?;Agent
urn:LCQuAD:id:3632;What is the draft team of Dale Mitchell (ice hockey) ?;Agent
urn:LCQuAD:id:2682;By whom is the broadcaster network Bounce TV founded?;Agent
urn:LCQuAD:id:4704;Who is the scientist whose doctoral student is Erich Bagge?;Agent
urn:LCQuAD:id:3160;Who are the parent  of the people that  has POD as Redding, Connecticut ?;Agent
urn:LCQuAD:id:780;What is the president whose lieutenants are Winston Bryant and Joe Purcell?;Agent
urn:LCQuAD:id:2;Name some leaders of the parent organisation of the Gestapo?;Agent
urn:LCQuAD:id:2737;Who are the people who died in a place architected by Jens Jensen;Agent
urn:LCQuAD:id:1776;Name the cover artist of the adventure of Tom sawyer ?;Agent
urn:LCQuAD:id:1913;Who did Bruce Bochy play for ? ;Agent
urn:LCQuAD:id:3706;What is the Band whose band member is Mark Middleton?;Agent
urn:LCQuAD:id:4127;Who was the vice president under which elizabeth alexander served?;Agent
urn:LCQuAD:id:2108;What is the profession of William Luther Hill ?;Agent
urn:LCQuAD:id:3753;List down the opponents of Frank Stilwell?;Agent
urn:LCQuAD:id:2996;Who is the writer of Neverwhere (radio play) ?;Agent
urn:LCQuAD:id:4867;Which football managers managed Middlesbrough F.C.?;Agent
urn:LCQuAD:id:1771;Who is the writer of the Cavalcade of America and The United States Steel Hour ?;Agent
urn:LCQuAD:id:4532;Which university is led by Jay Gogue?;Agent
urn:LCQuAD:id:758;List the leaders of the government agencies whose jurisdiction was German-occupied Europe.;Agent
urn:LCQuAD:id:250;List the cast member of the movies whose producer is Mark Johnson.;Agent
urn:LCQuAD:id:3468;Bud Adams owns which american football team?;Agent
urn:LCQuAD:id:3029;For which team did both Butch Metzger and Brian Horwitz debuted ? ;Agent
urn:LCQuAD:id:1194;For which team does hunter pence play for?;Agent
urn:LCQuAD:id:2235;What band was Afrika Baby Bam a part of, and often performed with Q Tip?;Agent
urn:LCQuAD:id:3699;Who is the prime minister of the successor of Kingsley Wood?;Agent
urn:LCQuAD:id:4908;WHo gave the lyrcis of Doonesbury ?;Agent
urn:LCQuAD:id:401;Who coached the marquet golden eagels during 2013;Agent
urn:LCQuAD:id:4910;Who are the parents of  Charles Phelps Taft II and Robert A. Taft?;Agent
urn:LCQuAD:id:2930;Where has the employee of Columbia Records  worked ?;Agent
urn:LCQuAD:id:3359;Who is the founder of Pittsburgh ?;Agent
urn:LCQuAD:id:1508;Who has had been the tenant of the stadium built by PCL construction firm?;Agent
urn:LCQuAD:id:1240;What is the university whose campus are Indiana and Iowa?;Agent
urn:LCQuAD:id:4125;Name the partners of the models whose one of the partner is Thom Evans ?;Agent
urn:LCQuAD:id:4803;Who has authored books published by the Perkins school for the Blind?;Agent
urn:LCQuAD:id:4348;Name the person whose child is Irne Joliot-Curie?;Agent
urn:LCQuAD:id:2711;Name few companies where don berlin and michael sears have worked together?;Agent
urn:LCQuAD:id:2791;With which musical artist is the music group which sung Mind Blowin  related to ?  ;Agent
urn:LCQuAD:id:4009;Who is known for are Battle of the Thames and War of 1812?;Agent
urn:LCQuAD:id:2866;Name the company founded by Jim Harris located in Harris County, Texas ?;Agent
urn:LCQuAD:id:3629;Name a fictional character whose relative is Uncle Henry and species is Human?;Agent
urn:LCQuAD:id:1708;Which bands are associated to David Paton?;Agent
urn:LCQuAD:id:2315;Who is the musician of Before I let you Go ?;Agent
urn:LCQuAD:id:609;Who developed the programming languages designed by Rob Pike?;Agent
urn:LCQuAD:id:167;Name the military unit whose garrison is Arlington County, Virginia and command structure is United States Department of Defense?;Agent
urn:LCQuAD:id:3700;which band was Roger waters in?;Agent
urn:LCQuAD:id:1700;What are the baseball players who played for San Francisco Giants?;Agent
urn:LCQuAD:id:2981;Who is the person whose parent is Ptolemy XII Auletes?;Agent
urn:LCQuAD:id:40;What are the schools whose city is Reading, Berkshire?;Agent
urn:LCQuAD:id:3217;Whose relatives are Uncle Henry (Oz) and Aunt Em?;Agent
urn:LCQuAD:id:74;Who gave the voice for Allen Walker ?;Agent
urn:LCQuAD:id:3909;Which companies have Kumho Asiana Group as their parent company?;Agent
urn:LCQuAD:id:4051;Who is the office holder whose resting place is Monticello?;Agent
urn:LCQuAD:id:2599;What fictional character s species is American Pekin duck;Agent
urn:LCQuAD:id:2768;Who is the president of United World College of Costa Rica ?;Agent
urn:LCQuAD:id:4703;Who is the  distributor of Rev (drink) ?;Agent
urn:LCQuAD:id:904;Who are the people which were the influencer of the person, who influenced Costanzo Preve ?;Agent
urn:LCQuAD:id:4441;What is the alma mater of Andrew W. Lewis ?;Agent
urn:LCQuAD:id:4690;Spanish harlem incident and girl from the north country were originally composed by whom?;Agent
urn:LCQuAD:id:4400;Name some relatives of the people studied in Manurewa High School?;Agent
urn:LCQuAD:id:3695;Who are the trainersof Candice Michelle?;Agent
urn:LCQuAD:id:2198;Which person belongs to the board of Howard Hughes Medical Institute?;Agent
urn:LCQuAD:id:1523;Which draft team od Dale Mitchell is also the tenant of Master Card center /;Agent
urn:LCQuAD:id:1200;List some things that Swedish people have become famous for?;AnatomicalStructure
urn:LCQuAD:id:2124;What ingredients are used in preparing the dish of Ragout fin?;AnatomicalStructure
urn:LCQuAD:id:4270;What is the label of Double Diamond (album) ?;AnatomicalStructure
urn:LCQuAD:id:915;What awards did the film director of The Haunted House win ?;Award
urn:LCQuAD:id:1744;which awards have been given to people who fought in the Battle of France?;Award
urn:LCQuAD:id:4315;What are the prizes won by the animator of The Skeleton Dance ?;Award
urn:LCQuAD:id:1669;What awards have been given to Screenwriters?;Award
urn:LCQuAD:id:2905;What awards have been given to some screenwriters?;Award
urn:LCQuAD:id:1815;What awards have been given to citizens of the Ottoman Empire?;Award
urn:LCQuAD:id:2059;What awards have the alumni of Academy of Fine Arts in Lodz achieved?;Award
urn:LCQuAD:id:4660;Which awards did the creator of A Barrel of Laughs, a Vale of Tears won ?;Award
urn:LCQuAD:id:3873;What are the awards won by the film editor of World of Tomorrow ?;Award
urn:LCQuAD:id:932;List the awards given to the relatives of Gregorios Bernardakis.;Award
urn:LCQuAD:id:2517;List the awards given to the important people of Aardman Animations?;Award
urn:LCQuAD:id:1760;What are all the prizes won by the writer of A Grand Day Out?;Award
urn:LCQuAD:id:4824;What were the awards won by the founder of Walt Disney Records ?;Award
urn:LCQuAD:id:2841;What are the awards won by the producer of Puss in Boots (film)?;Award
urn:LCQuAD:id:1830;What award was won by executive producer of Shaun the Sheep?;Award
urn:LCQuAD:id:2320;What is the honorary title of the narrator of Everything Will Be OK?;Award
urn:LCQuAD:id:4790;What is the prize awarded to Bruce Beutler ?;Award
urn:LCQuAD:id:2335;What awards were given to the producer of Chicken Little?;Award
urn:LCQuAD:id:3239;What are the prizes awarded to the main members of DisneyToon Studios?;Award
urn:LCQuAD:id:579;what awards have been giving to Muhammad Yunus?;Award
urn:LCQuAD:id:2306;Name the awards that have been given to the writer made famous for Creature Comforts?;Award
urn:LCQuAD:id:265;Which awards are presented by Swedish Academy?;Award
urn:LCQuAD:id:3229;Name the award given in Norway and presented by Swedish Academy ?;Award
urn:LCQuAD:id:1556;What currencies are circulated in the countries where people speak French?;Currency
urn:LCQuAD:id:2851;What currencies are used in the countries which have been governed by Francois Hollande?;Currency
urn:LCQuAD:id:3273;What is the currency of the country of Kerguelen Islands?;Currency
urn:LCQuAD:id:1360;Which engine s successor s predecessor is BMW M10?;Device
urn:LCQuAD:id:3914;What product is made by Sony and Foxconn togather?;Device
urn:LCQuAD:id:2856;List all the developers of the Oddworld series?;Device
urn:LCQuAD:id:3865;Which appliance s CPU is Cell (microprocessor) and predecessor is PlayStation 2?;Device
urn:LCQuAD:id:4778;Which developer of  the Spider-Man: Edge of Time is the  successor of PlayStation 2 ?;Device
urn:LCQuAD:id:169;what are some devices made by asus?;Device
urn:LCQuAD:id:4799;Which appliance has cpu from Freescale Semiconductor and Marvell Technology Group?;Device
urn:LCQuAD:id:4196;What are some products manufactured by Sony? ;Device
urn:LCQuAD:id:1858;What is the device whose successor s CPU is by AMD?;Device
urn:LCQuAD:id:4200;What have some famous Christians died of?;Disease
urn:LCQuAD:id:831;Who is the spouse of Willian Menalaus?;Disease
urn:LCQuAD:id:3765;Name the cause of death of Martino Martini ?;Disease
urn:LCQuAD:id:2564;How did Letitia MacTavish Hargrave died ?;Disease
urn:LCQuAD:id:4645;What killed John Thompson Mason and Martino Martini?;Disease
urn:LCQuAD:id:1338;To which religion does the commander of South Thailand insurgency belong?;EthnicGroup
urn:LCQuAD:id:2836;What are some non fiction subjects dealt with in fantasy novels?;EthnicGroup
urn:LCQuAD:id:2746;What is the ideology of Palang Dharma Party ?;EthnicGroup
urn:LCQuAD:id:4925;Which idelogy of the Palang Dharma Party is also the  faith of Miao people ?;EthnicGroup
urn:LCQuAD:id:3103;What religion is followed by the commander of Defense Security Command?;EthnicGroup
urn:LCQuAD:id:4893;What faith do hang chuon naron and Kron Ngoy follow?;EthnicGroup
urn:LCQuAD:id:495;What political ideology of the Palang Dharma Party is relegion of Inthakin?;EthnicGroup
urn:LCQuAD:id:113;What religions do politicians in the Korean Minjoo Party follow?;EthnicGroup
urn:LCQuAD:id:286;Name the religious affiliation of Vagif Aliyev ?;EthnicGroup
urn:LCQuAD:id:1510;What is the type of Vesak ?;EthnicGroup
urn:LCQuAD:id:1586;Which religion s people are member of BJP?;EthnicGroup
urn:LCQuAD:id:3558;People of which religion have been the members of parliament, and are from the Kalutara Electoral district?;EthnicGroup
urn:LCQuAD:id:1698;What kind of buildings were designed by Pyusawhti?;EthnicGroup
urn:LCQuAD:id:2319;What is the ideology of the Union of Cambodian Democrats which is also the ideology of Palang Dharma Party ?;EthnicGroup
urn:LCQuAD:id:464;Who is the founder of Hohenau, Paraguay?;EthnicGroup
urn:LCQuAD:id:4573;Which religions are followed by people in England?;EthnicGroup
urn:LCQuAD:id:4627;Which religion followers are in the Royal Thai Army?;EthnicGroup
urn:LCQuAD:id:2020;Which religion did both anupong paochinda and udit raj follow?;EthnicGroup
urn:LCQuAD:id:607;What religion s politicians are in the Malaysian Chinese association?;EthnicGroup
urn:LCQuAD:id:400;The Prime minister who worked in the Khmer Issarak follows which religion?;EthnicGroup
urn:LCQuAD:id:181;List the religion of people in the Cambodian human rights party?;EthnicGroup
urn:LCQuAD:id:3489;What are all the religions that have been followed by the Sir Lankan attorneys?;EthnicGroup
urn:LCQuAD:id:3451;What religions are followed by economists?;EthnicGroup
urn:LCQuAD:id:4831;In what wars was Steve Buyer involved?;Event
urn:LCQuAD:id:1038;Which wars were fought by the commander whose deputy was Robert T. Herres?;Event
urn:LCQuAD:id:1345;Which are the races in which Martin Molony participated?;Event
urn:LCQuAD:id:2968;List the battles in which alumni of US Army Command and General Staff College fought?;Event
urn:LCQuAD:id:3414;Which military battles are associated with Israel?;Event
urn:LCQuAD:id:2591;In which wars did commanders born in Indochina fight?;Event
urn:LCQuAD:id:1006;name the races where bobby beasley took part ?;Event
urn:LCQuAD:id:2042;In which military conflict were Phm Vn ng and John McEwen commanders ?;Event
urn:LCQuAD:id:115;What were the major actions taken by the politicians living in Gales Ferry, Connecticut?;Event
urn:LCQuAD:id:2359;Colin Powell was the commander of which military conflict ?;Event
urn:LCQuAD:id:85;In which war did Roh Tae Woo and Lee Leffingwell fight?;Event
urn:LCQuAD:id:4970;Name the military conflict whose commander was Colin Powell and took place in israel ?;Event
urn:LCQuAD:id:2071;In what battles did president Park Chung-hee participate?;Event
urn:LCQuAD:id:2848;In which racing championships did Bobby Beasley and Martin Molony participate?;Event
urn:LCQuAD:id:4411;List the ingredients of Kaszanka?;Food
urn:LCQuAD:id:87;What can be cooked out of things belonging to the order Sapindales?;Food
urn:LCQuAD:id:1310;Name some dishes made with flowering plants.;Food
urn:LCQuAD:id:4860;What beverages originate in Leuven?;Food
urn:LCQuAD:id:371;What are some cars which came before the ones on a GM B base?;MeanOfTransportation
urn:LCQuAD:id:1985;What all are in the states whose anthem is Ja, vi esker dette landet?;MeanOfTransportation
urn:LCQuAD:id:2639;What is the occupation of the people who are born in Iowa?;PersonFunction
urn:LCQuAD:id:3752;What are the beverages whose origin is England?;Species
urn:LCQuAD:id:3338;Which species  members are there in the animal kingdom?;Species
urn:LCQuAD:id:1392;What are the mammals whose phylum is Chordate?;Species
urn:LCQuAD:id:4681;What mammals are classified into Diprotodontia ?;Species
urn:LCQuAD:id:1469;What are some primates?;Species
urn:LCQuAD:id:2245;What mammals fall into the biological family Canidae?;Species
